FECHA;GERENCIA;NOMBREGERENCIA;CS;CENTRO;FASE DESESCALADA;x_geo;y_geo;zbs_geo;PROVINCIA;Posición;MUNICIPIO
2020-05-13;1701;Gerencia de Ávila;170101;C.S. ARENAS SAN PEDRO;Fase 0;-5.1146939;40.1963342;ARENAS SAN PEDRO;Ávila;40.1963342,-5.1146939;ARENAS DE SAN PEDRO/HORNILLO (EL)/ARENAL (EL)/GUISANDO
2020-05-13;1701;Gerencia de Ávila;170105;C.S. AVILA RURAL;Fase 0;-4.6711786;40.6384702;AVILA RURAL;Ávila;40.6384702,-4.6711786;AVILA/BERLANAS (LAS)/CASASOLA/GALLEGOS DE ALTAMIROS/MARLIN/MIRONCILLO/MONSALUPE/OSO (EL)/PAJARES DE ADAJA/SAN BARTOLOME DE PINARES/SAN JUAN DE LA NAVA/SERRADA (LA)/TOLBAÑOS/BARRACO (EL)/COLILLA (LA)/GEMUÑO/GOTARRENDURA/HERRADON DE PINARES/MEDIANA DE VOLTOYA/MINGORRIA/MUÑOPEPE/NIHARRA/OJOS-ALBOS/SALOBRAL/SAN ESTEBAN DE LOS PATOS/SANTA CRUZ DE PINARES/TORNADIZOS DE AVILA/VEGA DE SANTA MARIA/BERROCALEJO DE ARAGONA/BLASCOSANCHO/CARDEÑOSA/FRESNO (EL)/HERNANSANCHO/MARTIHERRERO/PADIERNOS/PEÑALBA DE AVILA/POZANCO/RIOFRIO/SAN PASCUAL/SANCHORREJA/SANTA MARIA DEL CUBILLO/SANTO DOMINGO DE LAS POSADAS/SOTALBO/VELAYOS
2020-05-13;1701;Gerencia de Ávila;170106;C.S. LANZAHITA;Fase 0;-4.8974015;40.2409102;LANZAHITA;Ávila;40.2409102,-4.8974015;GAVILANES/LANZAHITA/MOMBELTRAN/MIJARES/PEDRO BERNARDO
2020-05-13;1701;Gerencia de Ávila;170111;C.S. CEBREROS;Fase 0;-4.4395554;40.4517812;CEBREROS;Ávila;40.4517812,-4.4395554;CEBREROS/TIEMBLO (EL)/HOYO DE PINARES (EL)
2020-05-13;1701;Gerencia de Ávila;170113;C.S. NAVARREDONDA GREDOS;Fase 0;-5.1468286;40.3763715;NAVARREDONDA GREDOS;Ávila;40.3763715,-5.1468286;CEPEDA LA MORA/SAN MARTIN DEL PIMPOLLAR/HOYOS DE MIGUEL MUÑOZ/HOYOS DEL ESPINO/NAVADIJOS/NAVARREDONDA DE GREDOS/SAN JUAN DE GREDOS/SAN MARTIN DE LA VEGA DEL ALBERCHE/GARGANTA DEL VILLAR/HOYOS DEL COLLADO
2020-05-13;1701;Gerencia de Ávila;170117;C.S. PIEDRAHITA;Fase 0;-5.308102;40.5423616;PIEDRAHITA;Ávila;40.5423616,-5.308102;BECEDILLAS/BONILLA DE LA SIERRA/COLLADO DEL MIRON/DIEGO DEL CARPIO/MALPARTIDA DE CORNEJA/MIRON (EL)/PIEDRAHITA/SAN MIGUEL DE SERREZUELA/TORTOLES/VILLAFRANCA DE LA SIERRA/VILLAR DE CORNEJA/HOYORREDONDO/NAVACEPEDILLA DE CORNEJA/PASCUALCOBO/SAN BARTOLOME DE CORNEJA/SANTA MARIA DEL BERROCAL/SANTIAGO DEL COLLADO/AREVALILLO/CASAS DEL PUERTO/MARTINEZ/MESEGAR DE CORNEJA/NARRILLOS DEL ALAMO/NAVAESCURIAL/SAN MIGUEL DE CORNEJA/ZAPARDIEL DE LA CAÑADA
2020-05-13;1702;Gerencia de Burgos;170206;C.S. CRISTOBAL ACOSTA;Fase 0;-3.6992069;42.3440772;CRISTOBAL ACOSTA;Burgos;42.3440772,-3.6992069;BURGOS
2020-05-13;1702;Gerencia de Burgos;170210;C.S. CONDADO DE TREVIÑO;Fase 0;-2.7067503;42.7338412;CONDADO DE TREVIÑO;Burgos;42.7338412,-2.7067503;PUEBLA DE ARGANZON (LA)/CONDADO DE TREVIÑO
2020-05-13;1702;Gerencia de Burgos;170212;C.S. GAMONAL ANTIGUA;Fase 0;-3.6191225;42.3758528;GAMONAL ANTIGUA;Burgos;42.3758528,-3.6191225;BURGOS
2020-05-13;1702;Gerencia de Burgos;170213;C.S. GAMONAL LAS TORRES;Fase 0;-3.6719481;42.3557004;GAMONAL LAS TORRES;Burgos;42.3557004,-3.6719481;BURGOS
2020-05-13;1702;Gerencia de Burgos;170220;C.S. MELGAR FERNAMENTAL;Propuesta Fase 1;-4.1777188;42.359536;MELGAR FERNAMENTAL;Burgos;42.359536,-4.1777188;CASTRILLO DE RIOPISUERGA/CASTRILLO MATAJUDIOS/CASTROJERIZ/HONTANAS/PADILLA DE ARRIBA/REZMONDO/VILLAQUIRAN DE LA PUEBLA/ZARZOSA DE RIO PISUERGA/ARENILLAS DE RIOPISUERGA/MELGAR DE FERNAMENTAL/PADILLA DE ABAJO/PEDROSA DEL PRINCIPE/SASAMON/CASTELLANOS DE CASTRO/VILLASANDINO
2020-05-13;1702;Gerencia de Burgos;170221;C.S. MIRANDA ESTE;Fase 0;-3.0550817;42.6675161;MIRANDA ESTE;Burgos;42.6675161,-3.0550817;ALTABLE/AMEYUGO/BOZOO/VALLUERCANES/MIRANDA DE EBRO/BUGEDO/PANCORBO/SANTA GADEA DEL CID
2020-05-13;1702;Gerencia de Burgos;170222;C.S. MIRANDA OESTE;Fase 0;-2.9563542;42.6840113;MIRANDA OESTE;Burgos;42.6840113,-2.9563542;MIRANDA DE EBRO
2020-05-13;1702;Gerencia de Burgos;170226;C.S. SALAS LOS INFANTES;Fase 0;-3.2811979;42.0588261;SALAS LOS INFANTES;Burgos;42.0588261,-3.2811979;BARBADILLO DE HERREROS/CASTRILLO DE LA REINA/CONTRERAS/GALLEGA (LA)/HACINAS/JARAMILLO DE LA FUENTE/PINILLA DE LOS BARRUECOS/VALLE DE VALDELAGUNA/VIZCAINOS/BARBADILLO DEL MERCADO/BARBADILLO DEL PEZ/CAMPOLARA/CARAZO/HORTIGÜELA/MONCALVILLO/SALAS DE LOS INFANTES/SAN MILLAN DE LARA/SANTO DOMINGO DE SILOS/CABEZON DE LA SIERRA/HUERTA DE ARRIBA/MAMBRILLAS DE LARA/MAMOLAR/MONTERRUBIO DE LA DEMANDA/PINILLA DE LOS MOROS/REVILLA Y AHEDO (LA)/RIOCAVADO DE LA SIERRA
2020-05-13;1702;Gerencia de Burgos;170227;C.S. SAN AGUSTIN;Fase 0;-3.6970311;42.3120645;SAN AGUSTIN;Burgos;42.3120645,-3.6970311;BURGOS
2020-05-13;1702;Gerencia de Burgos;170228;C.S. SANTA CLARA;Fase 0;-3.6638629;42.3283523;SANTA CLARA;Burgos;42.3283523,-3.6638629;BURGOS
2020-05-13;1702;Gerencia de Burgos;170229;C.S. SEDANO;Fase 1;-3.7494493;42.7559832;SEDANO;Burgos;42.7559832,-3.7494493;VALLE DE ZAMANZAS/ALTOS (LOS)/SARGENTES DE LA LORA/TUBILLA DEL AGUA/VALLE DE SEDANO
2020-05-13;1702;Gerencia de Burgos;170236;C.S. JOSE LUIS SANTAMARIA;Fase 0;-3.6625856;42.3778915;JOSE LUIS SANTAMARIA;Burgos;42.3778915,-3.6625856;BURGOS
2020-05-13;1703;Gerencia de León;170301;C.S. ARMUNIA;Fase 0;-5.6250478;42.4904947;ARMUNIA;León;42.4904947,-5.6250478;ARDON/CHOZAS DE ABAJO/LEON/SANTOVENIA DE LA VALDONCINA/ONZONILLA/VEGA DE INFANZONES
2020-05-13;1703;Gerencia de León;170302;C.S. ASTORGA I;Fase 0;-6.0592017;42.472513;ASTORGA I;León;42.472513,-6.0592017;ASTORGA/SAN JUSTO DE LA VEGA/VILLAOBISPO DE OTERO
2020-05-13;1703;Gerencia de León;170303;C.S. ASTORGA II;Fase 0;-6.1802328;42.4989784;ASTORGA II;León;42.4989784,-6.1802328;ASTORGA/BRAZUELO/MAGAZ DE CEPEDA/VAL DE SAN LORENZO/VILLAFRANCA DEL BIERZO/LUCILLO/LUYEGO/SANTA COLOMBA DE SOMOZA/SANTIAGO MILLAS/VILLAMEJIL/QUINTANA DEL CASTILLO/SOBRADO/VALDERREY/VILLAGATON
2020-05-13;1703;Gerencia de León;170307;C.S. CUENCA BERNESGA;Fase 0;-5.6824618;42.9003761;CUENCA BERNESGA;León;42.9003761,-5.6824618;POLA DE GORDON (LA)/VILLAMANIN/ROBLA (LA)
2020-05-13;1703;Gerencia de León;170308;C.S. LA BAÑEZA I;Fase 0;-5.9064216;42.2735381;LA BAÑEZA I;León;42.2735381,-5.9064216;BAÑEZA (LA)/SANTA ELENA DE JAMUZ/SOTO DE LA VEGA/SANTA MARIA DE LA ISLA
2020-05-13;1703;Gerencia de León;170310;C.S. TRUCHAS;Fase 1;-6.5124396;42.2812357;TRUCHAS;León;42.2812357,-6.5124396;ENCINEDO/CASTRILLO DE CABRERA/TRUCHAS
2020-05-13;1703;Gerencia de León;170312;C.S. ERAS DE RENUEVA;Fase 0;-5.4972298;42.723601;ERAS DE RENUEVA;León;42.723601,-5.4972298;GARRAFE DE TORIO/VILLAQUILAMBRE/LEON/SANTA COLOMBA DE CURUEÑO
2020-05-13;1703;Gerencia de León;170315;C.S. CRUCERO;Fase 0;-5.5865679;42.6003574;CRUCERO;León;42.6003574,-5.5865679;LEON/SAN ANDRES DEL RABANEDO
2020-05-13;1703;Gerencia de León;170318;C.S. MANSILLA MULAS;Propuesta Fase 1;-5.3429113;42.4399063;MANSILLA MULAS;León;42.4399063,-5.3429113;MANSILLA MAYOR/SANTA CRISTINA DE VALMADRIGAL/VILLAMORATIEL DE LAS MATAS/VILLATURIEL/BURGO RANERO (EL)/GUSENDOS DE LOS OTEROS/VALVERDE-ENRIQUE/VILLANUEVA DE LAS MANZANAS/VILLASABARIEGO/CAMPO DE VILLAVIDEL/CORBILLOS DE LOS OTEROS/MANSILLA DE LAS MULAS/SANTAS MARTAS
2020-05-13;1703;Gerencia de León;170320;C.S. RIAÑO;Fase 1;-4.9636057;43.0527831;RIAÑO;León;43.0527831,-4.9636057;MARAÑA/RIAÑO/BURON/ACEBEDO/BOCA DE HUERGANO/OSEJA DE SAJAMBRE/POSADA DE VALDEON
2020-05-13;1703;Gerencia de León;170322;C.S. RIBERA DEL ORBIGO;Fase 0;-5.8615923;42.5482323;RIBERA DEL ORBIGO;León;42.5482323,-5.8615923;BUSTILLO DEL PARAMO/CARRIZO/SANTA MARINA DEL REY/HOSPITAL DE ORBIGO/RIELLO/VILLARES DE ORBIGO/BENAVIDES/CIMANES DEL TEJAR/LLAMAS DE LA RIBERA/QUINTANA DEL CASTILLO/TURCIA/VILLADANGOS DEL PARAMO/VILLAREJO DE ORBIGO
2020-05-13;1704;Gerencia de Ponferrada;170401;C.S. BEMBIBRE;Propuesta Fase 1;-6.3377018;42.6657692;BEMBIBRE;León;42.6657692,-6.3377018;VILLAGATON/IGÜEÑA/TORRE DEL BIERZO/BEMBIBRE/CASTROPODAME/FOLGOSO DE LA RIBERA/NOCEDA DEL BIERZO
2020-05-13;1704;Gerencia de Ponferrada;170404;C.S. PONFERRADA I;Propuesta Fase 1;-6.5098923;42.5043763;PONFERRADA I;León;42.5043763,-6.5098923;PONFERRADA/CONGOSTO/MOLINASECA
2020-05-13;1704;Gerencia de Ponferrada;170407;C.S. PUENTE DOMINGO FLOREZ;Propuesta Fase 1;-6.7140276;42.4127795;PUENTE DOMINGO FLOREZ;León;42.4127795,-6.7140276;PUENTE DE DOMINGO FLOREZ/BENUZA/BORRENES/CARUCEDO
2020-05-13;1704;Gerencia de Ponferrada;170409;C.S. VILLABLINO;Propuesta Fase 1;-6.3637869;42.924184;VILLABLINO;León;42.924184,-6.3637869;VILLABLINO/PALACIOS DEL SIL
2020-05-13;1704;Gerencia de Ponferrada;170410;C.S. VILLAFRANCA BIERZO;Propuesta Fase 1;-6.8923344;42.6316166;VILLAFRANCA BIERZO;León;42.6316166,-6.8923344;CARUCEDO/SOBRADO/VILLAFRANCA DEL BIERZO/BARJAS/OENCIA/TRABADELO/VILLADECANES/BALBOA/CORULLON/VEGA DE VALCARCE
2020-05-13;1704;Gerencia de Ponferrada;170411;C.S. PONFERRADA IV;Propuesta Fase 1;-6.6267109;42.5980544;PONFERRADA IV;León;42.5980544,-6.6267109;CABAÑAS RARAS/PONFERRADA
2020-05-13;1705;Gerencia de Palencia;170505;C.S. FROMISTA;Fase 0;-4.3777922;42.2112657;FROMISTA;Palencia;42.2112657,-4.3777922;AMAYUELAS DE ARRIBA/ASTUDILLO/BOADILLA DEL CAMINO/ITERO DEL CASTILLO/MELGAR DE YUSO/REVENGA DE CAMPOS/SAN CEBRIAN DE CAMPOS/SANTOYO/TAMARA DE CAMPOS/VILLALACO/AMUSCO/REQUENA DE CAMPOS/RIBAS DE CAMPOS/FROMISTA/ITERO DE LA VEGA/MARCILLA DE CAMPOS/PIÑA DE CAMPOS/POBLACION DE CAMPOS/VALBUENA DE PISUERGA/VILLODRE/VILLOVIECO
2020-05-13;1705;Gerencia de Palencia;170508;C.S. JARDINILLOS;Fase 0;-4.5383516;42.0122939;JARDINILLOS;Palencia;42.0122939,-4.5383516;PALENCIA
2020-05-13;1705;Gerencia de Palencia;170511;C.S. PALENCIA RURAL;Fase 0;-4.5447492;42.0232248;PALENCIA RURAL;Palencia;42.0232248,-4.5447492;FUENTES DE VALDEPERO/MONZON DE CAMPOS/VALDEOLMILLOS/VILLAUMBRALES/HUSILLOS/MAGAZ DE PISUERGA/PALENCIA/SANTA CECILIA DEL ALCOR/SOTO DE CERRATO/AUTILLA DEL PINO/GRIJOTA/VILLALOBON
2020-05-13;1705;Gerencia de Palencia;170512;C.S. PAREDES DE NAVA;Propuesta Fase 1;-4.7078451;42.1692388;PAREDES DE NAVA;Palencia;42.1692388,-4.7078451;BECERRIL DE CAMPOS/VALLE DEL RETORTILLO/FUENTES DE NAVA/PAREDES DE NAVA/RIBEROS DE LA CUEZA/VILLANUEVA DEL REBOLLAR/CARDEÑOSA DE VOLPEJERA/VILLAMUERA DE LA CUEZA
2020-05-13;1705;Gerencia de Palencia;170514;C.S. SALDAÑA;Fase 0;-4.7204164;42.560098;SALDAÑA;Palencia;42.560098,-4.7204164;AYUELA/BUSTILLO DE LA VEGA/POZA DE LA VEGA/RENEDO DE LA VEGA/TABANERA DE VALDAVIA/VALDERRABANO/VILLAELES DE VALDAVIA/VILLARRABE/VILLASILA DE VALDAVIA/PINO DEL RIO/PUEBLA DE VALDAVIA (LA)/QUINTANILLA DE ONSOÑA/RESPENDA DE LA PEÑA/SALDAÑA/VILLABASTA DE VALDAVIA/VILLOTA DEL PARAMO/BUENAVISTA DE VALDAVIA/CONGOSTO DE VALDAVIA/PEDROSA DE LA VEGA/SANTERVAS DE LA VEGA/VILLALUENGA DE LA VEGA
2020-05-13;1705;Gerencia de Palencia;170517;C.S. VENTA DE BAÑOS;Fase 0;-4.4303075;41.8572175;VENTA DE BAÑOS;Palencia;41.8572175,-4.4303075;CASTRILLO DE ONIELO/CUBILLAS DE CERRATO/DUEÑAS/POBLACION DE CERRATO/ALBA DE CERRATO/CEVICO DE LA TORRE/VERTAVILLO/HONTORIA DE CERRATO/TARIEGO DE CERRATO/VALLE DE CERRATO/VENTA DE BAÑOS
2020-05-13;1705;Gerencia de Palencia;170520;C.S. VILLAMURIEL DE CERRATO;Propuesta Fase 1;-4.5083248;41.9521254;VILLAMURIEL DE CERRATO;Palencia;41.9521254,-4.5083248;VILLAMURIEL DE CERRATO
2020-05-13;1706;Gerencia de Salamanca;170604;C.S. CALZADA VALDUNCIEL;Propuesta Fase 1;-5.7649621;41.1556443;CALZADA VALDUNCIEL;Salamanca;41.1556443,-5.7649621;SANTIZ/TOPAS/ARCO (EL)/CALZADA DE VALDUNCIEL/SAN PELAYO DE GUAREÑA/TORRESMENUDAS/ALDEARRODRIGO/AÑOVER DE TORMES/FORFOLEDA/PALACIOS DEL ARZOBISPO/VALDELOSA/VALDUNCIEL/ZAMAYON
2020-05-13;1706;Gerencia de Salamanca;170613;C.S. GUIJUELO;Fase 0;-5.6473268;40.5420836;GUIJUELO;Salamanca;40.5420836,-5.6473268;CABEZA DE BEJAR (LA)/FUENTERROBLE DE SALVATIERRA/GUIJO DE AVILA/PEROMINGO/PUEBLA DE SAN MEDEL/TALA (LA)/ALDEAVIEJA DE TORMES/CESPEDOSA DE TORMES/FRESNEDOSO/GALLEGOS DE SOLMIRON/GUIJUELO/NAVA DE BEJAR/NAVAMORALES/PIZARRAL/PUENTE DEL CONGOSTO/SANTOS (LOS)/BERROCAL DE SALVATIERRA/CALZADA DE DON DIEGO/CASAFRANCA/FUENTES DE BEJAR/LEDRADA/MONTEJO/SALVATIERRA DE TORMES/SANTIBAÑEZ DE BEJAR/SORIHUELA/VALDELACASA/VALVERDE DE VALDELACASA
2020-05-13;1706;Gerencia de Salamanca;170617;C.S. LINARES DE RIOFRIO;Fase 0;-5.8782411;40.6057622;LINARES DE RIOFRIO;Salamanca;40.6057622,-5.8782411;HERGUIJUELA DEL CAMPO/MEMBRIBE DE LA SIERRA/SAN ESTEBAN DE LA SIERRA/SAN MIGUEL DE VALERO/SIERPE (LA)/TORNADIZO (EL)/ENDRINAL/ESCURIAL DE LA SIERRA/FRADES DE LA SIERRA/LINARES DE RIOFRIO/MONLEON/BARBALOS/SANTIBAÑEZ DE LA SIERRA/VALERO
2020-05-13;1706;Gerencia de Salamanca;170622;C.S. PERIURBANA NORTE;Fase 0;-5.6415859;41.0249771;PERIURBANA NORTE;Salamanca;41.0249771,-5.6415859;ALDEALENGUA/ALDEARRUBIA/ALMENARA DE TORMES/CASTELLANOS DE MORISCOS/CASTELLANOS DE VILLIQUERA/MONTERRUBIO DE ARMUÑA/MORISCOS/SAN MORALES/VALVERDON/VILLARES DE LA REINA/JUZBADO/SAN CRISTOBAL DE LA CUESTA/CABRERIZOS/VILLAMAYOR
2020-05-13;1706;Gerencia de Salamanca;170623;C.S. PERIURBANO SUR;Fase 0;-5.773642;40.9106826;PERIURBANO SUR;Salamanca;40.9106826,-5.773642;ALDEATEJADA/ALDEAVIEJA DE TORMES/CARBAJOSA DE LA SAGRADA/MONTERRUBIO DE LA SIERRA/PINO DE TORMES (EL)/SALAMANCA/SAN PEDRO DEL VALLE/VEGA DE TIRADOS/ZARAPICOS/DOÑINOS DE SALAMANCA/GALINDO Y PERAHUY/GOLPEJAS/MIRANDA DE AZAN/ROLLAN/ARAPILES/BARBADILLO/CARRASCAL DE BARREGAS/MORILLE/MOZARBEZ/PARADA DE ARRIBA/SAN PEDRO DE ROZADOS
2020-05-13;1706;Gerencia de Salamanca;170628;C.S. SANTA MARTA DE TORMES;Fase 0;-5.5307167;40.9275702;SANTA MARTA DE TORMES;Salamanca;40.9275702,-5.5307167;PELABRAVO/CALVARRASA DE ABAJO/CALVARRASA DE ARRIBA/ENCINAS DE ABAJO/MACHACON/SANTA MARTA DE TORMES/VILLAGONZALO DE TORMES
2020-05-13;1706;Gerencia de Salamanca;170633;C.S. VILLORIA;Fase 0;-5.3715956;41.0345487;VILLORIA;Salamanca;41.0345487,-5.3715956;ARABAYONA DE MOGICA/BABILAFUENTE/CANTALPINO/PEDROSO DE LA ARMUÑA (EL)/CORDOVILLA/MORIÑIGO/VILLORUELA
2020-05-13;1706;Gerencia de Salamanca;170635;C.S. UNIVERSIDAD CENTRO;Fase 0;-5.6668451;40.9635604;UNIVERSIDAD CENTRO;Salamanca;40.9635604,-5.6668451;SALAMANCA
2020-05-13;1707;Gerencia de Segovia;170703;C.S. CUELLAR;Fase 0;-4.3165518;41.3472504;CUELLAR;Segovia;41.3472504,-4.3165518;FRESNEDA DE CUELLAR/VALLELADO/CHAÑE/GOMEZSERRACIN/OLOMBRADA/PINAREJOS/SANCHONUÑO/CUELLAR/FRUMALES/SAMBOAL/SAN CRISTOBAL DE CUELLAR
2020-05-13;1707;Gerencia de Segovia;170705;C.S. NAVAFRIA;Propuesta Fase 1;-3.7774351;41.0988251;NAVAFRIA;Segovia;41.0988251,-3.7774351;ARCONES/CASLA/GALLEGOS/MATABUENA/OREJANA/PELAYOS DEL ARROYO/SANTIUSTE DE PEDRAZA/SANTO TOME DEL PUERTO/NAVAFRIA/PEDRAZA/PRADENA/SOTOSALBOS/TORRE VAL DE SAN PEDRO/ALDEALENGUA DE PEDRAZA/ARAHUETES/COLLADO HERMOSO
2020-05-13;1707;Gerencia de Segovia;170713;C.S. VILLACASTIN;Fase 0;-4.4085747;40.7829124;VILLACASTIN;Segovia;40.7829124,-4.4085747;MAELLO/MONTERRUBIO/VEGAS DE MATUTE/VILLACASTIN/NAVAS DE SAN ANTONIO/VALDEPRADOS/ZARZUELA DEL MONTE/ITUERO Y LAMA/LABAJOS
2020-05-13;1707;Gerencia de Segovia;170714;C.S. EL ESPINAR;Fase 0;-4.2225274;40.7307872;EL ESPINAR;Segovia;40.7307872,-4.2225274;ESPINAR (EL)
2020-05-13;1708;Gerencia de Soria;170801;C.S. AGREDA;Fase 0;-1.9990845;41.8696333;AGREDA;Soria;41.8696333,-1.9990845;CASTILRUIZ/DEVANOS/VOZMEDIANO/AGREDA/CIGUDOSA/MAGAÑA/TREVAGO/VALDELAGUA DEL CERRO/FUENTESTRUN/MATALEBRERAS/SAN FELICES
2020-05-13;1708;Gerencia de Soria;170805;C.S. EL BURGO DE OSMA;Fase 0;-3.0173364;41.5822815;EL BURGO DE OSMA;Soria;41.5822815,-3.0173364;BLACOS/FRESNO DE CARACENA/GORMAZ/RECUERDA/RIOSECO DE SORIA/UCERO/VALDENEBRO/BURGO DE OSMA-CIUDAD DE OSMA/CARRASCOSA DE ABAJO/NAFRIA DE UCERO/QUINTANAS DE GORMAZ/VALDEMALUQUE/TORREBLACOS/VILLANUEVA DE GORMAZ
2020-05-13;1708;Gerencia de Soria;170807;C.S. GOMARA;Fase 0;-2.1536023;41.5519374;GOMARA;Soria;41.5519374,-2.1536023;ALMAZUL/GOMARA/VELILLA DE LOS AJOS/BLIECOS/CARABANTES/FUENTELMONGE/MAJAN/QUIÑONERIA/REZNOS/SERON DE NAGIMA/TORLENGUA/VILLASECA DE ARCIEL/ALMENAR DE SORIA/CAÑAMAQUE/CIHUELA/DEZA/TEJADO/TORRUBIA DE SORIA
2020-05-13;1708;Gerencia de Soria;170809;C.S. PINARES-COVALEDA;Fase 0;-2.819235;41.9661517;PINARES-COVALEDA;Soria;41.9661517,-2.819235;COVALEDA/DURUELO DE LA SIERRA/MOLINOS DE DUERO/MONTENEGRO DE CAMEROS/VINUESA/SALDUERO
2020-05-13;1708;Gerencia de Soria;170813;C.S. SORIA NORTE;Fase 0;-2.4772902;41.7676962;SORIA NORTE;Soria;41.7676962,-2.4772902;SORIA
2020-05-13;1708;Gerencia de Soria;170814;C.S. SORIA SUR;Fase 0;-2.4659611;41.7606339;SORIA SUR;Soria;41.7606339,-2.4659611;RABANOS (LOS)/SORIA
2020-05-13;1709;Gerencia de Valladolid Oeste;170906;C.S. PLAZA DEL EJERCITO;Fase 0;-4.7383372;41.6365797;PLAZA DEL EJERCITO;Valladolid;41.6365797,-4.7383372;VALLADOLID
2020-05-13;1709;Gerencia de Valladolid Oeste;170909;C.S. LAGUNA DE DUERO;Fase 0;-4.7293581;41.5472386;LAGUNA DE DUERO;Valladolid;41.5472386,-4.7293581;BOECILLO/LAGUNA DE DUERO/VIANA DE CEGA
2020-05-13;1709;Gerencia de Valladolid Oeste;170913;C.S. MEDINA DE RIOSECO;Fase 0;-5.0000709;41.858445;MEDINA DE RIOSECO;Valladolid;41.858445,-5.0000709;CASTROMONTE/MEDINA DE RIOSECO/MUDARRA (LA)/VILLANUEVA DE SAN MANCIO/MONTEALEGRE DE CAMPOS/MORAL DE LA REINA/TAMARIZ DE CAMPOS/BERRUECES/VALDENEBRO DE LOS VALLES/VALVERDE DE CAMPOS/VILLABRAGIMA/VILLALBA DE LOS ALCORES
2020-05-13;1709;Gerencia de Valladolid Oeste;170915;C.S. PARQUESOL;Fase 0;-4.7609774;41.6353453;PARQUESOL;Valladolid;41.6353453,-4.7609774;VALLADOLID
2020-05-13;1709;Gerencia de Valladolid Oeste;170924;C.S. VILLAFRECHOS;Propuesta Fase 1;-5.2179261;41.8799318;VILLAFRECHOS;Valladolid;41.8799318,-5.2179261;AGUILAR DE CAMPOS/POZUELO DE LA ORDEN/VILLAFRECHOS/BARCIAL DE LA LOMA/BOLAÑOS DE CAMPOS/PALAZUELO DE VEDIJA/TORDEHUMOS/VILLAMURIEL DE CAMPOS/CABREROS DEL MONTE/MORALES DE CAMPOS/SANTA EUFEMIA DEL ARROYO/VILLAGARCIA DE CAMPOS/VILLANUEVA DE LOS CABALLEROS
2020-05-13;1709;Gerencia de Valladolid Oeste;170928;C.S. DELICIAS II;Fase 0;-4.7327299;41.6090563;DELICIAS II;Valladolid;41.6090563,-4.7327299;VALLADOLID
2020-05-13;1710;Gerencia de Valladolid Este;171003;C.S. CIRCUNVALACION;Fase 0;-4.6758644;41.6546802;CIRCUNVALACION;Valladolid;41.6546802,-4.6758644;VALLADOLID
2020-05-13;1710;Gerencia de Valladolid Este;171006;C.S. ISCAR;Fase 0;-4.5398679;41.3527561;ISCAR;Valladolid;41.3527561,-4.5398679;COGECES DE ISCAR/FUENTE EL OLMO DE ISCAR/PEDRAJAS DE SAN ESTEBAN/MATA DE CUELLAR/MEGECES/VILLAVERDE DE ISCAR/ISCAR/REMONDO
2020-05-13;1710;Gerencia de Valladolid Este;171009;C.S. PILARICA;Fase 0;-4.7114053;41.6545997;PILARICA;Valladolid;41.6545997,-4.7114053;VALLADOLID
2020-05-13;1710;Gerencia de Valladolid Este;171010;C.S. CIRCULAR;Fase 0;-4.7175863;41.6487178;CIRCULAR;Valladolid;41.6487178,-4.7175863;VALLADOLID
2020-05-13;1710;Gerencia de Valladolid Este;171012;C.S. RONDILLA II;Fase 0;-4.7205359;41.664046;RONDILLA II;Valladolid;41.664046,-4.7205359;VALLADOLID
2020-05-13;1710;Gerencia de Valladolid Este;171014;C.S. SAN PABLO;Fase 0;-4.7265359;41.6561919;SAN PABLO;Valladolid;41.6561919,-4.7265359;VALLADOLID
2020-05-13;1710;Gerencia de Valladolid Este;171015;C.S. PEÑAFIEL;Fase 0;-4.1875837;41.5834053;PEÑAFIEL;Valladolid;41.5834053,-4.1875837;CURIEL DE DUERO/LANGAYO/PEÑAFIEL/RABANO/SAN LLORENTE/VALBUENA DE DUERO/BOCOS DE DUERO/CAMPASPERO/CANALEJAS DE PEÑAFIEL/CASTRILLO DE DUERO/COGECES DEL MONTE/MANZANILLO/PIÑEL DE ABAJO/PIÑEL DE ARRIBA/QUINTANILLA DE ARRIBA/BAHABON/CORRALES DE DUERO/FOMPEDRAZA/OLMOS DE PEÑAFIEL/PESQUERA DE DUERO/TORRE DE PEÑAFIEL/TORRESCARCELA/VALDEARCOS DE LA VEGA
2020-05-13;1710;Gerencia de Valladolid Este;171016;C.S. PORTILLO;Fase 0;-4.5726832;41.4774359;PORTILLO;Valladolid;41.4774359,-4.5726832;CAMPORREDONDO/MONTEMAYOR DE PILILLA/PEDRAJA DE PORTILLO (LA)/SAN MIGUEL DEL ARROYO/VILORIA/ALDEA DE SAN MIGUEL/ALDEAMAYOR DE SAN MARTIN/MOJADOS/PORTILLO
2020-05-13;1710;Gerencia de Valladolid Este;171017;C.S. SERRADA;Fase 0;-4.8411889;41.4508581;SERRADA;Valladolid;41.4508581,-4.8411889;MATAPOZUELOS/VENTOSA DE LA CUESTA/SERRADA/VALDESTILLAS/SECA (LA)/VILLANUEVA DE DUERO
2020-05-13;1710;Gerencia de Valladolid Este;171018;C.S. TUDELA;Fase 0;-4.4669681;41.6034399;TUDELA;Valladolid;41.6034399,-4.4669681;QUINTANILLA DE ONESIMO/SARDON DE DUERO/VILLABAÑEZ/OLIVARES DE DUERO/PARRILLA (LA)/TUDELA DE DUERO/SANTIBAÑEZ DE VALCORBA/TRASPINEDO/VILLAVAQUERIN
2020-05-13;1710;Gerencia de Valladolid Este;171022;C.S. MEDINA CAMPO URBANO;Fase 0;-4.9149855;41.3123252;MEDINA CAMPO URBANO;Valladolid;41.3123252,-4.9149855;MEDINA DEL CAMPO
2020-05-13;1710;Gerencia de Valladolid Este;171025;C.S. VALLADOLID RURAL I;Fase 0;-4.6211316;41.6733784;VALLADOLID RURAL I;Valladolid;41.6733784,-4.6211316;CABEZON DE PISUERGA/CASTRONUEVO DE ESGUEVA/VILLARMENTERO DE ESGUEVA/RENEDO DE ESGUEVA/SANTOVENIA DE PISUERGA
2020-05-13;1711;Gerencia de Zamora;171101;C.S. PARADA DEL MOLINO;Fase 0;-5.7547882;41.5067966;PARADA DEL MOLINO;Zamora;41.5067966,-5.7547882;ZAMORA
2020-05-13;1711;Gerencia de Zamora;171102;C.S. ALCAÑICES;Fase 1;-6.3315738;41.7589564;ALCAÑICES;Zamora;41.7589564,-6.3315738;ALCAÑICES/TRABAZOS/FIGUERUELA DE ARRIBA/GALLEGOS DEL RIO/MAHIDE/PINO DEL ORO/RABANALES/RABANO DE ALISTE/SAMIR DE LOS CAÑOS/FONFRIA/SAN VICENTE DE LA CABEZA/SAN VITERO/VIÑAS
2020-05-13;1711;Gerencia de Zamora;171104;C.S. BENAVENTE NORTE;Fase 0;-5.7625318;42.0547064;BENAVENTE NORTE;Zamora;42.0547064,-5.7625318;BENAVENTE/MORALES DE REY/POBLADURA DEL VALLE/SANTA CRISTINA DE LA POLVOROSA/TORRE DEL VALLE (LA)/VILLAFERRUEÑA/BRIME DE URZ/COOMONTE/QUINTANILLA DE URZ/QUIRUELAS DE VIDRIALES/SANTA MARIA DE LA VEGA/FRESNO DE LA POLVOROSA/MAIRE DE CASTROPONCE/MANGANESES DE LA POLVOROSA/VILLABRAZARO/VILLANAZAR
2020-05-13;1711;Gerencia de Zamora;171105;C.S. BENAVENTE SUR;Fase 0;-5.6713176;41.9561123;BENAVENTE SUR;Zamora;41.9561123,-5.6713176;BURGANES DE VALVERDE/FUENTES DE ROPEL/NAVIANOS DE VALVERDE/SANTA COLOMBA DE LAS MONJAS/SANTOVENIA/VILLANAZAR/BARCIAL DEL BARCO/BENAVENTE/BRETO/FRIERA DE VALVERDE/MATILLA DE ARZON/SAN CRISTOBAL DE ENTREVIÑAS/SAN MIGUEL DEL VALLE/VALDESCORRIEL/VILLAVEZA DEL AGUA/ARCOS DE LA POLVOROSA/BRETOCINO/CASTROGONZALO/MILLES DE LA POLVOROSA/VILLANUEVA DE AZOAGUE
2020-05-13;1711;Gerencia de Zamora;171108;C.S. CARBAJALES DE ALBA;Fase 1;-5.9952992;41.6823131;CARBAJALES DE ALBA;Zamora;41.6823131,-5.9952992;SANTA EUFEMIA DEL BARCO/VEGALATRAVE/CARBAJALES DE ALBA/LOSACIO/MANZANAL DEL BARCO/OLMILLOS DE CASTRO/LOSACINO/VIDEMALA
2020-05-13;1711;Gerencia de Zamora;171110;C.S. CORRALES DEL VINO;Fase 1;-5.7465007;41.3106752;CORRALES DEL VINO;Zamora;41.3106752,-5.7465007;CABAÑAS DE SAYAGO/CORRALES/CORRALES DEL VINO/PELEAS DE ABAJO/VILLANUEVA DE CAMPEAN/CUBO DE TIERRA DEL VINO (EL)/FUENTESPREADAS/PEÑAUSENDE/SANTA CLARA DE AVEDILLO/CASASECA DE CAMPEAN/CUELGAMURES/JAMBRINA/MAYALDE/PIÑERO (EL)
2020-05-13;1711;Gerencia de Zamora;171117;C.S. TORO;Fase 0;-5.4133008;41.5359437;TORO;Zamora;41.5359437,-5.4133008;ABEZAMES/MORALES DE TORO/PELEAGONZALO/PINILLA DE TORO/TORO/VEZDEMARBAN/VILLALONSO/BUSTILLO DEL ORO/POZOANTIGUO/VALDEFINJAS/FUENTESECAS/MALVA/VILLARDONDIEGO/VILLAVENDIMIO
2020-05-13;1711;Gerencia de Zamora;171118;C.S. SANTIBAÑEZ VIDRIAL;Fase 1;-6.0490574;42.0931624;SANTIBAÑEZ VIDRIAL;Zamora;42.0931624,-6.0490574;AYOO DE VIDRIALES/BRIME DE SOG/VILLAGERIZ/ARRABALDE/CUBO DE BENAVENTE/GRANUCILLO/MOLEZUELAS DE LA CARBALLEDA/SANTIBAÑEZ DE VIDRIALES/UÑA DE QUINTANA/ALCUBILLA DE NOGALES/FUENTE ENCALADA
2020-05-13;1711;Gerencia de Zamora;171119;C.S. VILLALPANDO;Fase 1;-5.4276016;41.8843207;VILLALPANDO;Zamora;41.8843207,-5.4276016;PRADO/QUINTANILLA DEL MONTE/SAN ESTEBAN DEL MOLAR/VILLAMAYOR DE CAMPOS/VILLAR DE FALLAVES/CERECINOS DE CAMPOS/COTANES DEL MONTE/QUINTANILLA DEL OLMO/SAN MARTIN DE VALDERADUEY/VEGA DE VILLALOBOS/VILLALOBOS/VILLALPANDO/VILLARDIGA/CAÑIZO/CASTROVERDE DE CAMPOS/TAPIOLES/VILLANUEVA DEL CAMPO
2020-05-13;1711;Gerencia de Zamora;171122;C.S. ZAMORA SUR;Fase 0;-5.7520988;41.4477098;ZAMORA SUR;Zamora;41.4477098,-5.7520988;CAZURRA/ENTRALA/MORALEJA DEL VINO/SANZOLES/ARCENILLAS/GEMA/MORALES DEL VINO/PERDIGON (EL)/VILLALAZAN/ZAMORA/CASASECA DE LAS CHANAS/MADRIDANOS/PERERUELA/VENIALBO/VILLARALBO
2020-05-18;1701;Gerencia de Ávila;170102;C.S. AREVALO;Fase 0;-4.7155883;41.0192187;AREVALO;Ávila;41.0192187,-4.7155883;ADANERO/ALDEASECA/CABEZAS DE ALAMBRE/DONHIERRO/DONJIMENO/ESPINOSA DE LOS CABALLEROS/GUTIERRE-MUÑOZ/NAVA DE AREVALO/ORBITA/PEDRO-RODRIGUEZ/SAN VICENTE DE AREVALO/VILLANUEVA DEL ACERAL/AREVALO/BOHODON (EL)/CANALES/CODORNIZ/CONSTANZANA/FUENTES DE AÑO/LANGA/MONTEJO DE AREVALO/SAN CRISTOBAL DE LA VEGA/SANCHIDRIAN/SINLABAJOS/DONVIDAS/MARTIN MUÑOZ DE LA DEHESA/MARTIN MUÑOZ DE LAS POSADAS/PALACIOS DE GODA/RAPARIEGOS/TIÑOSILLOS/TOLOCIRIO/VILLANUEVA DE GOMEZ
2020-05-18;1701;Gerencia de Ávila;170112;C.S. FONTIVEROS;Fase 0;-5.0026168;40.9224581;FONTIVEROS;Ávila;40.9224581,-5.0026168;CANTIVEROS/CISLA/COLLADO DE CONTRERAS/CONSTANZANA/FONTIVEROS/SALVADIOS/BERNUY-ZAPARDIEL/MUÑOSANCHO/RIVILLA DE BARAJAS/CABEZAS DEL POZO/CRESPOS/FLORES DE AVILA/FUENTE EL SAUZ/GIMIALCON
2020-05-18;1701;Gerencia de Ávila;170114;C.S. LAS NAVAS MARQUES;Fase 0;-4.3241213;40.6144359;LAS NAVAS MARQUES;Ávila;40.6144359,-4.3241213;NAVAS DEL MARQUES (LAS)/NAVALPERAL DE PINARES/PEGUERINOS
2020-05-18;1702;Gerencia de Burgos;170201;C.S. ARANDA NORTE;Fase 0;-3.6555077;41.6891216;ARANDA NORTE;Burgos;41.6891216,-3.6555077;ARANDA DE DUERO
2020-05-18;1702;Gerencia de Burgos;170203;C.S. ARANDA SUR;Fase 0;-3.706626;41.6526832;ARANDA SUR;Burgos;41.6526832,-3.706626;ARANDA DE DUERO
2020-05-18;1702;Gerencia de Burgos;170207;C.S. I. LOPEZ SAIZ;Fase 0;-3.6981439;42.351365;I. LOPEZ SAIZ;Burgos;42.351365,-3.6981439;BURGOS
2020-05-18;1702;Gerencia de Burgos;170208;C.S. BURGOS RURAL NORTE;Fase 0;-3.5966157;42.4521283;BURGOS RURAL NORTE;Burgos;42.4521283,-3.5966157;ARRAYA DE OCA/FRESNO DE RODILLA/HURONES/MEDINA DE POMAR/MONASTERIO DE RODILLA/MONTORIO/PINEDA DE LA SIERRA/VALLE DE SEDANO/BARRIOS DE COLINA/CARDEÑUELA RIOPICO/HUERMECES/MERINDAD DE RIO UBIERNA/RUBENA/SANTA MARIA DEL INVIERNO/VALLE DE LAS NAVAS/VALLE DE SANTIBAÑEZ/ALFOZ DE QUINTANADUEÑAS/ARLANZON/ATAPUERCA/BURGOS/ORBANEJA RIOPICO/QUINTANAORTUÑO/QUINTANAPALLA/QUINTANILLA VIVAR/SOTRAGERO/URBEL DEL CASTILLO/VILLAESCUSA LA SOMBRIA/VILLASUR DE HERREROS/VILLAYERNO MORQUILLAS
