FECHA;GERENCIA;NOMBREGERENCIA;CS;CENTRO;FASE DESESCALADA;x_geo;y_geo;zbs_geo;PROVINCIA;Posición;MUNICIPIO
2020-06-08;1711;Gerencia de Zamora;171106;C.S. CAMARZANA DE TERA;Fase 2;-6.0366846;41.9912912;CAMARZANA DE TERA;Zamora;41.9912912,-6.0366846;SAN PEDRO DE CEQUE/VEGA DE TERA/CALZADILLA DE TERA/CAMARZANA DE TERA/MELGAR DE TERA/MICERECES DE TERA/SANTIBAÑEZ DE TERA/SANTA CROYA DE TERA/VILLANUEVA DE LAS PERAS
2020-06-08;1711;Gerencia de Zamora;171110;C.S. CORRALES DEL VINO;Fase 2;-5.7465007;41.3106752;CORRALES DEL VINO;Zamora;41.3106752,-5.7465007;CABAÑAS DE SAYAGO/CORRALES/CORRALES DEL VINO/PELEAS DE ABAJO/VILLANUEVA DE CAMPEAN/CUBO DE TIERRA DEL VINO (EL)/FUENTESPREADAS/PEÑAUSENDE/SANTA CLARA DE AVEDILLO/CASASECA DE CAMPEAN/CUELGAMURES/JAMBRINA/MAYALDE/PIÑERO (EL)
2020-06-08;1711;Gerencia de Zamora;171114;C.S. PUEBLA DE SANABRIA;Fase 2;-6.6501789;42.0813187;PUEBLA DE SANABRIA;Zamora;42.0813187,-6.6501789;PALACIOS DE SANABRIA/TREFACIO/COBREROS/PEDRALBA DE LA PRADERIA/ROBLEDA-CERVANTES/GALENDE/PUEBLA DE SANABRIA/REQUEJO/ROSINOS DE LA REQUEJADA/SAN JUSTO
2020-06-08;1711;Gerencia de Zamora;171120;C.S. VIRGEN DE LA CONCHA;Fase 2;-5.7331438;41.5156123;VIRGEN DE LA CONCHA;Zamora;41.5156123,-5.7331438;ZAMORA
2020-06-11;1701;Gerencia de Ávila;170102;C.S. AREVALO;Fase 2;-4.7155883;41.0192187;AREVALO;Ávila;41.0192187,-4.7155883;ADANERO/ALDEASECA/CABEZAS DE ALAMBRE/DONHIERRO/DONJIMENO/ESPINOSA DE LOS CABALLEROS/GUTIERRE-MUÑOZ/NAVA DE AREVALO/ORBITA/PEDRO-RODRIGUEZ/SAN VICENTE DE AREVALO/VILLANUEVA DEL ACERAL/AREVALO/BOHODON (EL)/CANALES/CODORNIZ/CONSTANZANA/FUENTES DE AÑO/LANGA/MONTEJO DE AREVALO/SAN CRISTOBAL DE LA VEGA/SANCHIDRIAN/SINLABAJOS/DONVIDAS/MARTIN MUÑOZ DE LA DEHESA/MARTIN MUÑOZ DE LAS POSADAS/PALACIOS DE GODA/RAPARIEGOS/TIÑOSILLOS/TOLOCIRIO/VILLANUEVA DE GOMEZ
2020-06-11;1701;Gerencia de Ávila;170103;C.S. AVILA ESTACION;Fase 2;-4.61;40.685;AVILA ESTACION;Ávila;40.685,-4.61;AVILA
2020-06-11;1701;Gerencia de Ávila;170106;C.S. LANZAHITA;Fase 2;-4.8974015;40.2409102;LANZAHITA;Ávila;40.2409102,-4.8974015;GAVILANES/LANZAHITA/MOMBELTRAN/MIJARES/PEDRO BERNARDO
2020-06-11;1701;Gerencia de Ávila;170110;C.S. CANDELEDA;Fase 2;-5.2770352;40.1758101;CANDELEDA;Ávila;40.1758101,-5.2770352;CANDELEDA/POYALES DEL HOYO
2020-06-11;1701;Gerencia de Ávila;170116;C.S. MOMBELTRAN;Fase 2;-4.996585;40.2764479;MOMBELTRAN;Ávila;40.2764479,-4.996585;SAN ESTEBAN DEL VALLE/SANTA CRUZ DEL VALLE/VILLAREJO DEL VALLE/CUEVAS DEL VALLE/MOMBELTRAN
2020-06-11;1701;Gerencia de Ávila;170119;C.S. SOTILLO DE ADRADA;Fase 2;-4.6472208;40.2954901;SOTILLO DE ADRADA;Ávila;40.2954901,-4.6472208;ADRADA (LA)/HIGUERA DE LAS DUEÑAS/SANTA MARIA DEL TIETAR/CASAVIEJA/CASILLAS/NAVAHONDILLA/PIEDRALAVES/SOTILLO DE LA ADRADA/FRESNEDILLA
2020-06-11;1702;Gerencia de Burgos;170204;C.S. BELORADO;Propuesta Fase 3;-3.2049005;42.3861643;BELORADO;Burgos;42.3861643,-3.2049005;BASCUÑANA/FRESNEÑA/REDECILLA DEL CAMPO/SANTA CRUZ DEL VALLE URBION/TOSANTOS/VALLE DE OCA/VALMALA/VILLAFRANCA MONTES DE OCA/CASTILDELGADO/ESPINOSA DEL CAMINO/FRESNO DE RIO TIRON/IBRILLOS/MIRANDA DE EBRO/PRADOLUENGO/VILORIA DE RIOJA/BELORADO/CEREZO DE RIO TIRON/CERRATON DE JUARROS/FRESNEDA DE LA SIERRA TIRON/REDECILLA DEL CAMINO/VILLAGALIJO/VILLAMBISTIA
2020-06-11;1702;Gerencia de Burgos;170216;C.S. LERMA;Propuesta Fase 3;-3.7309756;41.9826165;LERMA;Burgos;41.9826165,-3.7309756;AVELLANOSA DE MUÑO/CILLERUELO DE ABAJO/FONTIOSO/LERMA/MECERREYES/OQUILLAS/PINILLA TRASMONTE/QUINTANILLA DEL AGUA Y TORDUELES/QUINTANILLA DEL COCO/SANTIBAÑEZ DE ESGUEVA/TEJADA/TORRECILLA DEL MONTE/TORREPADRE/VILLAFRUELA/VILLALMANZO/VILLAMAYOR DE LOS MONTES/CEBRECOS/CILLERUELO DE ARRIBA/MADRIGALEJO DEL MONTE/NEBREDA/PUENTEDURA/RETUERTA/ROYUELA DE RIO FRANCO/SANTA CECILIA/SANTIBAÑEZ DEL VAL/SOLARANA/TORDOMAR/VILLAHOZ/ZAEL/BAHABON DE ESGUEVA/CABAÑES DE ESGUEVA/CIRUELOS DE CERVERA/COVARRUBIAS/CUEVAS DE SAN CLEMENTE/IGLESIARRUBIA/PINEDA TRASMONTE/QUINTANILLA DE LA MATA/SANTA INES
2020-06-11;1702;Gerencia de Burgos;170217;C.S. LOS COMUNEROS;Propuesta Fase 3;-3.6855424;42.3637215;LOS COMUNEROS;Burgos;42.3637215,-3.6855424;BURGOS
2020-06-11;1702;Gerencia de Burgos;170221;C.S. MIRANDA ESTE;Propuesta Fase 3;-3.0550817;42.6675161;MIRANDA ESTE;Burgos;42.6675161,-3.0550817;ALTABLE/AMEYUGO/BOZOO/VALLUERCANES/MIRANDA DE EBRO/BUGEDO/PANCORBO/SANTA GADEA DEL CID
2020-06-11;1702;Gerencia de Burgos;170222;C.S. MIRANDA OESTE;Propuesta Fase 3;-2.9563542;42.6840113;MIRANDA OESTE;Burgos;42.6840113,-2.9563542;MIRANDA DE EBRO
2020-06-11;1702;Gerencia de Burgos;170227;C.S. SAN AGUSTIN;Propuesta Fase 3;-3.6970311;42.3120645;SAN AGUSTIN;Burgos;42.3120645,-3.6970311;BURGOS
2020-06-11;1702;Gerencia de Burgos;170229;C.S. SEDANO;Propuesta Fase 3;-3.7494493;42.7559832;SEDANO;Burgos;42.7559832,-3.7494493;VALLE DE ZAMANZAS/ALTOS (LOS)/SARGENTES DE LA LORA/TUBILLA DEL AGUA/VALLE DE SEDANO
2020-06-11;1702;Gerencia de Burgos;170230;C.S. VALLE DE LOSA;Propuesta Fase 3;-3.1799508;42.9747524;VALLE DE LOSA;Burgos;42.9747524,-3.1799508;JUNTA DE VILLALBA DE LOSA/BERBERANA/MEDINA DE POMAR/VALLE DE LOSA
2020-06-11;1702;Gerencia de Burgos;170231;C.S. VALLE TOBALINA;Propuesta Fase 3;-3.245942;42.763078;VALLE TOBALINA;Burgos;42.763078,-3.245942;PARTIDO DE LA SIERRA EN TOBALINA/VALLE DE TOBALINA/FRIAS/OÑA
2020-06-11;1702;Gerencia de Burgos;170233;C.S. VILLADIEGO;Propuesta Fase 3;-4.0436158;42.5457831;VILLADIEGO;Burgos;42.5457831,-4.0436158;PEDROSA DEL PARAMO/SOTRESGUDO/SUSINOS DEL PARAMO/SASAMON/SORDILLOS/TOBAR/VILLADIEGO/VILLAMAYOR DE TREVIÑO/BASCONCILLOS DEL TOZO/GRIJALBA/HORMAZAS (LAS)/HUMADA/MANCILES/URBEL DEL CASTILLO/VILLEGAS
2020-06-11;1702;Gerencia de Burgos;170234;C.S. VALLE DE MENA;Propuesta Fase 3;-3.2710544;43.1138884;VALLE DE MENA;Burgos;43.1138884,-3.2710544;VALLE DE MENA
2020-06-11;1702;Gerencia de Burgos;170235;C.S. VILLARCAYO;Propuesta Fase 3;-3.5891204;42.8916432;VILLARCAYO;Burgos;42.8916432,-3.5891204;MERINDAD DE VALDIVIELSO/VALLE DE MANZANEDO/VILLARCAYO DE MERINDAD DE CASTILLA LA VIEJA
2020-06-11;1703;Gerencia de León;170306;C.S. CISTIERNA;Propuesta Fase 3;-5.074482;42.8018865;CISTIERNA;León;42.8018865,-5.074482;ERCINA (LA)/CISTIERNA/PRADO DE LA GUZPEÑA/SABERO/ALMANZA/CEBANICO/CREMENES/PRIORO/VALDERRUEDA
2020-06-11;1703;Gerencia de León;170307;C.S. CUENCA BERNESGA;Propuesta Fase 3;-5.6824618;42.9003761;CUENCA BERNESGA;León;42.9003761,-5.6824618;POLA DE GORDON (LA)/VILLAMANIN/ROBLA (LA)
2020-06-11;1703;Gerencia de León;170308;C.S. LA BAÑEZA I;Propuesta Fase 3;-5.9064216;42.2735381;LA BAÑEZA I;León;42.2735381,-5.9064216;BAÑEZA (LA)/SANTA ELENA DE JAMUZ/SOTO DE LA VEGA/SANTA MARIA DE LA ISLA
2020-06-11;1703;Gerencia de León;170309;C.S. BAÑEZA II;Propuesta Fase 3;-5.9772118;42.2458606;BAÑEZA II;León;42.2458606,-5.9772118;ALIJA DEL INFANTADO/ANTIGUA (LA)/DESTRIANA/PALACIOS DE LA VALDUERNA/REGUERAS DE ARRIBA/RIEGO DE LA VEGA/ROPERUELOS DEL PARAMO/SAN ADRIAN DEL VALLE/SAN CRISTOBAL DE LA POLANTERA/SANTA MARIA DE LA ISLA/CASTRILLO DE LA VALDUERNA/CASTROCALBON/QUINTANA DEL MARCO/VALDEFUENTES DEL PARAMO/VILLAZALA/BAÑEZA (LA)/CASTROCONTRIGO/CEBRONES DEL RIO/POZUELO DEL PARAMO/QUINTANA Y CONGOSTO/SAN ESTEBAN DE NOGALES/VILLAMONTAN DE LA VALDUERNA
2020-06-11;1703;Gerencia de León;170316;C.S. JOSE AGUADO I;Propuesta Fase 3;-5.5503247;42.5942556;JOSE AGUADO I;León;42.5942556,-5.5503247;LEON
2020-06-11;1703;Gerencia de León;170319;C.S. MATALLANA DE TORIO;Propuesta Fase 3;-5.5413909;42.9258494;MATALLANA DE TORIO;León;42.9258494,-5.5413909;MATALLANA DE TORIO/VEGACERVERA/CARMENES
2020-06-11;1703;Gerencia de León;170320;C.S. RIAÑO;Propuesta Fase 3;-4.9636057;43.0527831;RIAÑO;León;43.0527831,-4.9636057;MARAÑA/RIAÑO/BURON/ACEBEDO/BOCA DE HUERGANO/OSEJA DE SAJAMBRE/POSADA DE VALDEON
2020-06-11;1703;Gerencia de León;170326;C.S. VALDERAS;Propuesta Fase 3;-5.4625731;42.0951135;VALDERAS;León;42.0951135,-5.4625731;CAMPAZAS/UNION DE CAMPOS (LA)/VILLAQUEJIDA/GORDONCILLO/CIMANES DE LA VEGA/QUINTANILLA DEL MOLAR/ROALES DE CAMPOS/URONES DE CASTROPONCE/VALDERAS
2020-06-11;1703;Gerencia de León;170327;C.S. VALENCIA DE D. JUAN;Propuesta Fase 3;-5.489176;42.278276;VALENCIA DE D. JUAN;León;42.278276,-5.489176;CASTILFALE/FUENTES DE CARBAJAL/VILLADEMOR DE LA VEGA/CABREROS DEL RIO/CUBILLAS DE LOS OTEROS/MATADEON DE LOS OTEROS/MATANZA/VILLABRAZ/VILLAMAÑAN/VILLAORNATE Y CASTRO/ALGADEFE/FRESNO DE LA VEGA/PAJARES DE LOS OTEROS/SAN MILLAN DE LOS CABALLEROS/TORAL DE LOS GUZMANES/VALDEMORA/VALENCIA DE DON JUAN/VILLAMANDOS
2020-06-11;1703;Gerencia de León;170328;C.S. TROBAJO DEL CAMINO;Propuesta Fase 3;-5.6842775;42.5750157;TROBAJO DEL CAMINO;León;42.5750157,-5.6842775;SAN ANDRES DEL RABANEDO/VALVERDE DE LA VIRGEN
2020-06-11;1704;Gerencia de Ponferrada;170402;C.S. CACABELOS;Propuesta Fase 3;-6.6923743;42.6184913;CACABELOS;León;42.6184913,-6.6923743;ARGANZA/CACABELOS/CAMPONARAYA/CARRACEDELO/SANCEDO
2020-06-11;1704;Gerencia de Ponferrada;170403;C.S. FABERO;Propuesta Fase 3;-6.7032857;42.8176963;FABERO;León;42.8176963,-6.7032857;FABERO/PERANZANES/CANDIN/VEGA DE ESPINAREDA
2020-06-11;1704;Gerencia de Ponferrada;170406;C.S. PONFERRADA III;Propuesta Fase 3;-6.6573868;42.5029679;PONFERRADA III;León;42.5029679,-6.6573868;PONFERRADA/PRIARANZA DEL BIERZO
2020-06-11;1704;Gerencia de Ponferrada;170407;C.S. PUENTE DOMINGO FLOREZ;Propuesta Fase 3;-6.7140276;42.4127795;PUENTE DOMINGO FLOREZ;León;42.4127795,-6.7140276;PUENTE DE DOMINGO FLOREZ/BENUZA/BORRENES/CARUCEDO
2020-06-11;1704;Gerencia de Ponferrada;170408;C.S. TORENO;Propuesta Fase 3;-6.5033694;42.7810332;TORENO;León;42.7810332,-6.5033694;BERLANGA DEL BIERZO/TORENO/PARAMO DEL SIL
2020-06-11;1704;Gerencia de Ponferrada;170411;C.S. PONFERRADA IV;Propuesta Fase 3;-6.6267109;42.5980544;PONFERRADA IV;León;42.5980544,-6.6267109;CABAÑAS RARAS/PONFERRADA
2020-06-11;1705;Gerencia de Palencia;170502;C.S. BALTANAS;Propuesta Fase 3;-4.1664881;41.9106172;BALTANAS;Palencia;41.9106172,-4.1664881;HERMEDES DE CERRATO/VILLAVIUDAS/CEVICO NAVERO/REINOSO DE CERRATO/ANTIGÜEDAD/BALTANAS/CASTRILLO DE DON JUAN/ESPINOSA DE CERRATO/VILLACONANCIO
2020-06-11;1705;Gerencia de Palencia;170503;C.S. CARRION DE LOS CONDES;Propuesta Fase 3;-4.624195;42.3504747;CARRION DE LOS CONDES;Palencia;42.3504747,-4.624195;BUSTILLO DEL PARAMO DE CARRION/LOMAS/PERALES/CARRION DE LOS CONDES/CERVATOS DE LA CUEZA/MANQUILLOS/NOGAL DE LAS HUERTAS/SERNA (LA)/VILLANUÑO DE VALDAVIA/VILLATURDE/VILLOLDO/ARCONADA/CALZADA DE LOS MOLINOS/LOMA DE UCIEZA/SAN MAMES DE CAMPOS/VALDE-UCIEZA/VILLALCAZAR DE SIRGA/VILLAMORONTA
2020-06-11;1705;Gerencia de Palencia;170505;C.S. FROMISTA;Propuesta Fase 3;-4.3777922;42.2112657;FROMISTA;Palencia;42.2112657,-4.3777922;AMAYUELAS DE ARRIBA/ASTUDILLO/BOADILLA DEL CAMINO/ITERO DEL CASTILLO/MELGAR DE YUSO/REVENGA DE CAMPOS/SAN CEBRIAN DE CAMPOS/SANTOYO/TAMARA DE CAMPOS/VILLALACO/AMUSCO/REQUENA DE CAMPOS/RIBAS DE CAMPOS/FROMISTA/ITERO DE LA VEGA/MARCILLA DE CAMPOS/PIÑA DE CAMPOS/POBLACION DE CAMPOS/VALBUENA DE PISUERGA/VILLODRE/VILLOVIECO
2020-06-11;1705;Gerencia de Palencia;170506;C.S. GUARDO;Propuesta Fase 3;-4.7793976;42.8075753;GUARDO;Palencia;42.8075753,-4.7793976;FRESNO DEL RIO/MANTINOS/SANTIBAÑEZ DE LA PEÑA/VILLALBA DE GUARDO/RESPENDA DE LA PEÑA/VELILLA DEL RIO CARRION/CONGOSTO DE VALDAVIA/GUARDO
2020-06-11;1705;Gerencia de Palencia;170511;C.S. PALENCIA RURAL;Propuesta Fase 3;-4.5447492;42.0232248;PALENCIA RURAL;Palencia;42.0232248,-4.5447492;FUENTES DE VALDEPERO/MONZON DE CAMPOS/VALDEOLMILLOS/VILLAUMBRALES/HUSILLOS/MAGAZ DE PISUERGA/PALENCIA/SANTA CECILIA DEL ALCOR/SOTO DE CERRATO/AUTILLA DEL PINO/GRIJOTA/VILLALOBON
2020-06-11;1705;Gerencia de Palencia;170514;C.S. SALDAÑA;Propuesta Fase 3;-4.7204164;42.560098;SALDAÑA;Palencia;42.560098,-4.7204164;AYUELA/BUSTILLO DE LA VEGA/POZA DE LA VEGA/RENEDO DE LA VEGA/TABANERA DE VALDAVIA/VALDERRABANO/VILLAELES DE VALDAVIA/VILLARRABE/VILLASILA DE VALDAVIA/PINO DEL RIO/PUEBLA DE VALDAVIA (LA)/QUINTANILLA DE ONSOÑA/RESPENDA DE LA PEÑA/SALDAÑA/VILLABASTA DE VALDAVIA/VILLOTA DEL PARAMO/BUENAVISTA DE VALDAVIA/CONGOSTO DE VALDAVIA/PEDROSA DE LA VEGA/SANTERVAS DE LA VEGA/VILLALUENGA DE LA VEGA
2020-06-11;1705;Gerencia de Palencia;170516;C.S. TORQUEMADA;Propuesta Fase 3;-4.1999618;42.0367418;TORQUEMADA;Palencia;42.0367418,-4.1999618;COBOS DE CERRATO/TORQUEMADA/VILLAMEDIANA/CORDOVILLA LA REAL/HORNILLOS DE CERRATO/PALENZUELA/QUINTANA DEL PUENTE/TABANERA DE CERRATO/VILLAHAN/HERRERA DE VALDECAÑAS
2020-06-11;1705;Gerencia de Palencia;170520;C.S. VILLAMURIEL DE CERRATO;Propuesta Fase 3;-4.5083248;41.9521254;VILLAMURIEL DE CERRATO;Palencia;41.9521254,-4.5083248;VILLAMURIEL DE CERRATO
2020-06-11;1706;Gerencia de Salamanca;170601;C.S. ALBA DE TORMES;Fase 2;-5.5135134;40.7460397;ALBA DE TORMES;Salamanca;40.7460397,-5.5135134;ALDEASECA DE ALBA/ARMENTEROS/BELEÑA/CHAGARCIA MEDIANERO/COCA DE ALBA/GAJATES/GALISANCHO/LARRODRIGO/NAVALES/PEDROSILLO DE ALBA/PEDROSILLO DE LOS AIRES/PELAYOS/VALDEMIERQUE/ANAYA DE ALBA/BUENAVISTA/EJEME/HORCAJO MEDIANERO/MAYA (LA)/PEDRAZA DE ALBA/SIETEIGLESIAS DE TORMES/TERRADILLOS/ALBA DE TORMES/ENCINAS DE ARRIBA/FRESNO ALHANDIGA/GALINDUSTE/GARCIHERNANDEZ/MARTINAMOR/PEÑARANDILLA/VALDECARROS
2020-06-11;1706;Gerencia de Salamanca;170602;C.S. ALDEADAVILA RIBERA;Fase 2;-6.6595106;41.1113017;ALDEADAVILA RIBERA;Salamanca;41.1113017,-6.6595106;CEREZAL DE PEÑAHORCADA/MIEZA/VILLASBUENAS/ALDEADAVILA DE LA RIBERA/BARRUECOPARDO/MASUECO/SALDEANA/SAUCELLE/MILANO (EL)/VILVESTRE/ZARZA DE PUMAREDA (LA)
2020-06-11;1706;Gerencia de Salamanca;170603;C.S. BEJAR;Fase 2;-5.8578389;40.3892584;BEJAR;Salamanca;40.3892584,-5.8578389;CALZADA DE BEJAR (LA)/COLMENAR DE MONTEMAYOR/HORCAJO DE MONTEMAYOR/LAGUNILLA/MONTEMAYOR DEL RIO/PEÑACABALLERA/SANCHOTELLO/SANTIBAÑEZ DE LA SIERRA/VALDEHIJADEROS/VALDELAGEVE/ALDEACIPRESTE/BEJAR/CANDELARIO/CERRO (EL)/HOYA (LA)/MOLINILLO/NAVACARROS/NAVALMORAL DE BEJAR/CANTAGALLO/CRISTOBAL/PINEDAS/PUERTO DE BEJAR/VALDEFUENTES DE SANGUSIN/VALLEJERA DE RIOFRIO
2020-06-11;1706;Gerencia de Salamanca;170606;C.S. CIUDAD RODRIGO;Fase 2;-6.4762406;40.6126798;CIUDAD RODRIGO;Salamanca;40.6126798,-6.4762406;ATALAYA (LA)/BODON (EL)/CASTILLEJO DE MARTIN VIEJO/ENCINA (LA)/SERRADILLA DEL ARROYO/SERRADILLA DEL LLANO/CIUDAD RODRIGO/MONSAGRO/PASTORES/SAELICES EL CHICO/SANCTI-SPIRITUS/TENEBRON/ZAMARRA/CARPIO DE AZABA
2020-06-11;1706;Gerencia de Salamanca;170608;C.S. FUENTE DE SAN ESTEBAN;Fase 2;-6.2514024;40.8046117;FUENTE DE SAN ESTEBAN;Salamanca;40.8046117,-6.2514024;BOADA/CABRILLAS/CASTRAZ/SAGRADA (LA)/FUENTE DE SAN ESTEBAN (LA)/PELARRODRIGUEZ/SAN MUÑOZ/BUENAMADRE/CUBO DE DON SANCHO (EL)/MARTIN DE YELTES
2020-06-11;1706;Gerencia de Salamanca;170612;C.S. GARRIDO SUR;Fase 2;-5.6376245;40.9715334;GARRIDO SUR;Salamanca;40.9715334,-5.6376245;SALAMANCA
2020-06-11;1706;Gerencia de Salamanca;170617;C.S. LINARES DE RIOFRIO;Fase 2;-5.8782411;40.6057622;LINARES DE RIOFRIO;Salamanca;40.6057622,-5.8782411;HERGUIJUELA DEL CAMPO/MEMBRIBE DE LA SIERRA/SAN ESTEBAN DE LA SIERRA/SAN MIGUEL DE VALERO/SIERPE (LA)/TORNADIZO (EL)/ENDRINAL/ESCURIAL DE LA SIERRA/FRADES DE LA SIERRA/LINARES DE RIOFRIO/MONLEON/BARBALOS/SANTIBAÑEZ DE LA SIERRA/VALERO
2020-06-11;1706;Gerencia de Salamanca;170619;C.S. MATILLA CAÑOS;Fase 2;-5.9732262;40.8405196;MATILLA CAÑOS;Salamanca;40.8405196,-5.9732262;ROBLIZA DE COJOS/SANCHON DE LA SAGRADA/ALDEHUELA DE LA BOVEDA/CALZADA DE DON DIEGO/CANILLAS DE ABAJO/MATILLA DE LOS CAÑOS DEL RIO/VILLALBA DE LOS LLANOS/CARRASCAL DEL OBISPO/TABERA DE ABAJO/VECINOS/VEGUILLAS (LAS)
2020-06-11;1706;Gerencia de Salamanca;170620;C.S. MIRANDA DEL CASTAÑAR;Fase 2;-6.0341157;40.4383859;MIRANDA DEL CASTAÑAR;Salamanca;40.4383859,-6.0341157;CEPEDA/HERGUIJUELA DE LA SIERRA/MADROÑAL/MIRANDA DEL CASTAÑAR/VILLANUEVA DEL CONDE/SOTOSERRANO/GARCIBUEY/SEQUEROS
2020-06-11;1706;Gerencia de Salamanca;170621;C.S. PEDROSILLO EL RALO;Fase 2;-5.4871391;41.1200652;PEDROSILLO EL RALO;Salamanca;41.1200652,-5.4871391;CABEZABELLOSA DE LA CALZADA/PARADA DE RUBIALES/PITIEGUA/TARDAGUILA/VALLESA DE LA GUAREÑA/VELLES (LA)/VILLAVERDE DE GUAREÑA/ARCEDIANO/CAÑIZAL/ESPINO DE LA ORBADA/ORBADA (LA)/PEDROSILLO EL RALO/ALDEANUEVA DE FIGUEROA/GOMECELLO/NEGRILLA DE PALENCIA/PAJARES DE LA LAGUNA/PALENCIA DE NEGRILLA
2020-06-11;1706;Gerencia de Salamanca;170623;C.S. PERIURBANO SUR;Fase 2;-5.773642;40.9106826;PERIURBANO SUR;Salamanca;40.9106826,-5.773642;ALDEATEJADA/ALDEAVIEJA DE TORMES/CARBAJOSA DE LA SAGRADA/MONTERRUBIO DE LA SIERRA/PINO DE TORMES (EL)/SALAMANCA/SAN PEDRO DEL VALLE/VEGA DE TIRADOS/ZARAPICOS/DOÑINOS DE SALAMANCA/GALINDO Y PERAHUY/GOLPEJAS/MIRANDA DE AZAN/ROLLAN/ARAPILES/BARBADILLO/CARRASCAL DE BARREGAS/MORILLE/MOZARBEZ/PARADA DE ARRIBA/SAN PEDRO DE ROZADOS
2020-06-11;1706;Gerencia de Salamanca;170624;C.S. PEÑARANDA;Fase 2;-5.2549602;40.8839787;PEÑARANDA;Salamanca;40.8839787,-5.2549602;ALARAZ/CANTARACILLO/MALPARTIDA/SALMORAL/SANTIAGO DE LA PUEBLA/CAMPO DE PEÑARANDA (EL)/VENTOSA DEL RIO ALMAR/VILLAR DE GALLIMAZO/ALCONADA/ALDEASECA DE LA FRONTERA/BOVEDA DEL RIO ALMAR/MACOTERA/MANCERA DE ABAJO/NAVA DE SOTROBAL/PARADINAS DE SAN JUAN/PEÑARANDA DE BRACAMONTE/RAGAMA/TORDILLOS
2020-06-11;1706;Gerencia de Salamanca;170626;C.S. ROBLEDA;Fase 2;-6.576536;40.3713532;ROBLEDA;Salamanca;40.3713532,-6.576536;HERGUIJUELA DE CIUDAD RODRIGO/MARTIAGO/ROBLEDA/SAHUGO (EL)/VILLASRUBIAS/PEÑAPARDA/AGALLAS/PAYO (EL)
2020-06-11;1706;Gerencia de Salamanca;170631;C.S. ELENA GINEL DIEZ;Fase 2;-5.707699;40.9515169;ELENA GINEL DIEZ;Salamanca;40.9515169,-5.707699;SALAMANCA
2020-06-11;1706;Gerencia de Salamanca;170633;C.S. VILLORIA;Fase 2;-5.3715956;41.0345487;VILLORIA;Salamanca;41.0345487,-5.3715956;ARABAYONA DE MOGICA/BABILAFUENTE/CANTALPINO/PEDROSO DE LA ARMUÑA (EL)/CORDOVILLA/MORIÑIGO/VILLORUELA
2020-06-11;1706;Gerencia de Salamanca;170634;C.S. VITIGUDINO;Fase 2;-6.397953;41.061593;VITIGUDINO;Salamanca;41.061593,-6.397953;ALMENDRA/BOGAJO/BRINCONES/CABEZA DEL CABALLO/ENCINASOLA DE LOS COMENDADORES/ESPADAÑA/PERALEJOS DE ARRIBA/POZOS DE HINOJO/SANCHON DE LA RIBERA/TRABANCA/VALDERRODRIGO/VALSALABROSO/VIDOLA (LA)/VILLAR DE PERALONSO/VILLARMUERTO/VILLAVIEJA DE YELTES/GUADRAMIRO/IRUELOS/MORONTA/PEREÑA DE LA RIBERA/VITIGUDINO/AHIGAL DE VILLARINO/BARCEO/CIPEREZ/PEÑA (LA)/PERALEJOS DE ABAJO/PUERTAS/VILLAR DE SAMANIEGO/VILLARES DE YELTES/VILLARINO DE LOS AIRES/YECLA DE YELTES
2020-06-11;1706;Gerencia de Salamanca;170635;C.S. UNIVERSIDAD CENTRO;Fase 2;-5.6668451;40.9635604;UNIVERSIDAD CENTRO;Salamanca;40.9635604,-5.6668451;SALAMANCA
2020-06-11;1706;Gerencia de Salamanca;170636;C.S. SAN JUAN;Fase 2;-5.6596496;40.9722411;SAN JUAN;Salamanca;40.9722411,-5.6596496;SALAMANCA
2020-06-11;1706;Gerencia de Salamanca;170637;C.S. CAPUCHINOS;Fase 2;-5.67021;40.9834149;CAPUCHINOS;Salamanca;40.9834149,-5.67021;SALAMANCA
2020-06-11;1707;Gerencia de Segovia;170707;C.S. RIAZA;Fase 2;-3.4554609;41.3634767;RIAZA;Segovia;41.3634767,-3.4554609;ALCONADA DE MADERUELO/AYLLON/RIBOTA/ALDEALENGUA DE SANTA MARIA/CEREZO DE ABAJO/CILLERUELO DE SAN MAMES/CORRAL DE AYLLON/FRESNO DE CANTESPINO/LANGUILLA/MADERUELO/MONTEJO DE TIERMES/RIAGUAS DE SAN BARTOLOME/RIAZA/CAMPO DE SAN PEDRO/CASTILLEJO DE MESLEON/CEREZO DE ARRIBA/MORAL DE HORNUEZ/SEQUERA DE FRESNO
2020-06-11;1707;Gerencia de Segovia;170712;C.S. SEPULVEDA;Fase 2;-3.712417;41.329873;SEPULVEDA;Segovia;41.329873,-3.712417;BOCEGUILLAS/CASTROSERNA DE ABAJO/CONDADO DE CASTILNOVO/FRESNO DE LA FUENTE/NAVARES DE ENMEDIO/PRADALES/VALLERUELA DE SEPULVEDA/ALDEANUEVA DE LA SERREZUELA/GRAJERA/SEPULVEDA/URUEÑAS/ALDEONTE/BARBOLLA/BERCIMUEL/CASTROSERRACIN/CEDILLO DE LA TORRE/DURUELO/ENCINAS/MATILLA (LA)/NAVARES DE AYUSO/NAVARES DE LAS CUEVAS/PAJAREJOS/SANTA MARTA DEL CERRO/SOTILLO/VALLERUELA DE PEDRAZA
2020-06-11;1707;Gerencia de Segovia;170714;C.S. EL ESPINAR;Fase 2;-4.2225274;40.7307872;EL ESPINAR;Segovia;40.7307872,-4.2225274;ESPINAR (EL)
2020-06-11;1707;Gerencia de Segovia;170715;C.S. SAN ILDEFONSO;Fase 2;-4.0179965;40.8500482;SAN ILDEFONSO;Segovia;40.8500482,-4.0179965;SAN ILDEFONSO
2020-06-11;1708;Gerencia de Soria;170801;C.S. AGREDA;Fase 2;-1.9990845;41.8696333;AGREDA;Soria;41.8696333,-1.9990845;CASTILRUIZ/DEVANOS/VOZMEDIANO/AGREDA/CIGUDOSA/MAGAÑA/TREVAGO/VALDELAGUA DEL CERRO/FUENTESTRUN/MATALEBRERAS/SAN FELICES
2020-06-11;1708;Gerencia de Soria;170802;C.S. ALMAZAN;Fase 2;-2.537595;41.4121402;ALMAZAN;Soria;41.4121402,-2.537595;ADRADAS/ALMAZAN/ALPANSEQUE/BORJABAD/MOMBLONA/NEPAS/VELAMAZAN/ALCUBILLA DE LAS PEÑAS/COSCURITA/MORON DE ALMAZAN/SOLIEDRA/ALENTISQUE/BARAONA/BARCA/CENTENERA DE ANDALUZ/ESCOBOSA DE ALMAZAN/MATAMALA DE ALMAZAN/NOLAY/TARODA/VILLASAYAS
2020-06-11;1708;Gerencia de Soria;170807;C.S. GOMARA;Fase 2;-2.1536023;41.5519374;GOMARA;Soria;41.5519374,-2.1536023;ALMAZUL/GOMARA/VELILLA DE LOS AJOS/BLIECOS/CARABANTES/FUENTELMONGE/MAJAN/QUIÑONERIA/REZNOS/SERON DE NAGIMA/TORLENGUA/VILLASECA DE ARCIEL/ALMENAR DE SORIA/CAÑAMAQUE/CIHUELA/DEZA/TEJADO/TORRUBIA DE SORIA
2020-06-11;1708;Gerencia de Soria;170812;C.S. S.PEDRO MANRIQUE;Fase 2;-2.293891;42.0324759;S.PEDRO MANRIQUE;Soria;42.0324759,-2.293891;ALDEHUELAS (LAS)/CERBON/VILLAR DEL RIO/VIZMANOS/YANGUAS/FUENTES DE MAGAÑA/ONCALA/SAN PEDRO MANRIQUE/SANTA CRUZ DE YANGUAS
2020-06-11;1708;Gerencia de Soria;170813;C.S. SORIA NORTE;Fase 2;-2.4772902;41.7676962;SORIA NORTE;Soria;41.7676962,-2.4772902;SORIA
2020-06-11;1709;Gerencia de Valladolid Oeste;170910;C.S. MAYORGA DE CAMPOS;Propuesta Fase 3;-5.2444328;42.1620332;MAYORGA DE CAMPOS;Valladolid;42.1620332,-5.2444328;CASTROBOL/CASTROPONCE/MAYORGA/MELGAR DE ABAJO/SAELICES DE MAYORGA/VALDUNQUILLO/MELGAR DE ARRIBA/VILLALBA DE LA LOMA/VILLALON DE CAMPOS/BECILLA DE VALDERADUEY/IZAGRE/MONASTERIO DE VEGA/VILLAVICENCIO DE LOS CABALLEROS
2020-06-11;1709;Gerencia de Valladolid Oeste;170914;C.S. MOTA DEL MARQUES;Propuesta Fase 3;-5.2237315;41.6665615;MOTA DEL MARQUES;Valladolid;41.6665615,-5.2237315;BENAFARCES/CASASOLA DE ARION/CASTROMEMBIBRE/MOTA DEL MARQUES/SAN CEBRIAN DE MAZOTE/URUEÑA/VILLARDEFRADES/MARZALES/SAN PEDRO DE LATARCE/TIEDRA/VEGA DE VALDETRONCO/VILLALBARBA/VILLAVELLID/ADALIA/GALLEGOS DE HORNIJA
2020-06-11;1709;Gerencia de Valladolid Oeste;170915;C.S. PARQUESOL;Propuesta Fase 3;-4.7609774;41.6353453;PARQUESOL;Valladolid;41.6353453,-4.7609774;VALLADOLID
2020-06-11;1709;Gerencia de Valladolid Oeste;170916;C.S. PISUERGA;Propuesta Fase 3;-4.8403081;41.5926952;PISUERGA;Valladolid;41.5926952,-4.8403081;GERIA/SIMANCAS/CIGUÑUELA/ARROYO DE LA ENCOMIENDA
2020-06-11;1709;Gerencia de Valladolid Oeste;170919;C.S. PARQUE ALAMEDA-COVARESA;Propuesta Fase 3;-4.7912209;41.5671132;PARQUE ALAMEDA-COVARESA;Valladolid;41.5671132,-4.7912209;VALLADOLID
2020-06-11;1709;Gerencia de Valladolid Oeste;170925;C.S. VILLALON DE CAMPOS;Propuesta Fase 3;-5.059256;42.1180914;VILLALON DE CAMPOS;Valladolid;42.1180914,-5.059256;CABEZON DE VALDERADUEY/CUENCA DE CAMPOS/FONTIHOYUELO/HERRIN DE CAMPOS/VEGA DE RUIPONCE/VILLACARRALON/VILLANUEVA DE LA CONDESA/BUSTILLO DE CHAVES/GATON DE CAMPOS/SANTERVAS DE CAMPOS/VILLABARUZ DE CAMPOS/VILLACID DE CAMPOS/VILLAGOMEZ LA NUEVA/CEINOS DE CAMPOS/VILLAFRADES DE CAMPOS/VILLALON DE CAMPOS
2020-06-11;1709;Gerencia de Valladolid Oeste;170926;C.S. VALLADOLID RURAL II;Propuesta Fase 3;-4.8965168;41.7013384;VALLADOLID RURAL II;Valladolid;41.7013384,-4.8965168;CASTRODEZA/ZARATAN/PEÑAFLOR DE HORNIJA/VILLANUBLA/WAMBA
2020-06-11;1709;Gerencia de Valladolid Oeste;170927;C.S. DELICIAS I;Propuesta Fase 3;-4.7079834;41.6161785;DELICIAS I;Valladolid;41.6161785,-4.7079834;CISTERNIGA/VALLADOLID
2020-06-11;1710;Gerencia de Valladolid Este;171003;C.S. CIRCUNVALACION;Propuesta Fase 3;-4.6758644;41.6546802;CIRCUNVALACION;Valladolid;41.6546802,-4.6758644;VALLADOLID
2020-06-11;1710;Gerencia de Valladolid Este;171008;C.S. TORTOLA;Propuesta Fase 3;-4.696616;41.6303261;TORTOLA;Valladolid;41.6303261,-4.696616;VALLADOLID
2020-06-11;1710;Gerencia de Valladolid Este;171017;C.S. SERRADA;Propuesta Fase 3;-4.8411889;41.4508581;SERRADA;Valladolid;41.4508581,-4.8411889;MATAPOZUELOS/VENTOSA DE LA CUESTA/SERRADA/VALDESTILLAS/SECA (LA)/VILLANUEVA DE DUERO
2020-06-11;1710;Gerencia de Valladolid Este;171022;C.S. MEDINA CAMPO URBANO;Propuesta Fase 3;-4.9149855;41.3123252;MEDINA CAMPO URBANO;Valladolid;41.3123252,-4.9149855;MEDINA DEL CAMPO
2020-06-11;1710;Gerencia de Valladolid Este;171025;C.S. VALLADOLID RURAL I;Propuesta Fase 3;-4.6211316;41.6733784;VALLADOLID RURAL I;Valladolid;41.6733784,-4.6211316;CABEZON DE PISUERGA/CASTRONUEVO DE ESGUEVA/VILLARMENTERO DE ESGUEVA/RENEDO DE ESGUEVA/SANTOVENIA DE PISUERGA
2020-06-11;1710;Gerencia de Valladolid Este;171026;C.S. CIGALES;Propuesta Fase 3;-4.660676;41.7859567;CIGALES;Valladolid;41.7859567,-4.660676;CIGALES/CORCOS/CUBILLAS DE SANTA MARTA/SAN MARTIN DE VALVENI/TRIGUEROS DEL VALLE/VALORIA LA BUENA/FUENSALDAÑA/MUCIENTES
2020-06-11;1711;Gerencia de Zamora;171103;C.S. ALTA SANABRIA;Propuesta Fase 3;-6.879117;42.0861616;ALTA SANABRIA;Zamora;42.0861616,-6.879117;HERMISENDE/PORTO/LUBIAN/PIAS
2020-06-11;1711;Gerencia de Zamora;171104;C.S. BENAVENTE NORTE;Propuesta Fase 3;-5.7625318;42.0547064;BENAVENTE NORTE;Zamora;42.0547064,-5.7625318;BENAVENTE/MORALES DE REY/POBLADURA DEL VALLE/SANTA CRISTINA DE LA POLVOROSA/TORRE DEL VALLE (LA)/VILLAFERRUEÑA/BRIME DE URZ/COOMONTE/QUINTANILLA DE URZ/QUIRUELAS DE VIDRIALES/SANTA MARIA DE LA VEGA/FRESNO DE LA POLVOROSA/MAIRE DE CASTROPONCE/MANGANESES DE LA POLVOROSA/VILLABRAZARO/VILLANAZAR
2020-06-11;1711;Gerencia de Zamora;171114;C.S. PUEBLA DE SANABRIA;Propuesta Fase 3;-6.6501789;42.0813187;PUEBLA DE SANABRIA;Zamora;42.0813187,-6.6501789;PALACIOS DE SANABRIA/TREFACIO/COBREROS/PEDRALBA DE LA PRADERIA/ROBLEDA-CERVANTES/GALENDE/PUEBLA DE SANABRIA/REQUEJO/ROSINOS DE LA REQUEJADA/SAN JUSTO
2020-06-11;1711;Gerencia de Zamora;171118;C.S. SANTIBAÑEZ VIDRIAL;Propuesta Fase 3;-6.0490574;42.0931624;SANTIBAÑEZ VIDRIAL;Zamora;42.0931624,-6.0490574;AYOO DE VIDRIALES/BRIME DE SOG/VILLAGERIZ/ARRABALDE/CUBO DE BENAVENTE/GRANUCILLO/MOLEZUELAS DE LA CARBALLEDA/SANTIBAÑEZ DE VIDRIALES/UÑA DE QUINTANA/ALCUBILLA DE NOGALES/FUENTE ENCALADA
