FECHA;GERENCIA;NOMBREGERENCIA;CS;CENTRO;FASE DESESCALADA;x_geo;y_geo;zbs_geo;PROVINCIA;Posición;MUNICIPIO
2020-05-22;1701;Gerencia de Ávila;170115;C.S. MADRIGAL DE LAS ALTAS TORRES;Fase 1;-5.020748;41.074037;MADRIGAL DE LAS ALTAS TORRES;Ávila;41.074037,-5.020748;BERCIAL DE ZAPARDIEL/BLASCONUÑO DE MATACABRAS/CASTELLANOS DE ZAPARDIEL/HORCAJO DE LAS TORRES/MADRIGAL DE LAS ALTAS TORRES/RASUEROS/SAN ESTEBAN DE ZAPARDIEL/BARROMAN/MORALEJA DE MATACABRAS/MAMBLAS
2020-05-22;1701;Gerencia de Ávila;170117;C.S. PIEDRAHITA;Propuesta Fase 1;-5.308102;40.5423616;PIEDRAHITA;Ávila;40.5423616,-5.308102;BECEDILLAS/BONILLA DE LA SIERRA/COLLADO DEL MIRON/DIEGO DEL CARPIO/MALPARTIDA DE CORNEJA/MIRON (EL)/PIEDRAHITA/SAN MIGUEL DE SERREZUELA/TORTOLES/VILLAFRANCA DE LA SIERRA/VILLAR DE CORNEJA/HOYORREDONDO/NAVACEPEDILLA DE CORNEJA/PASCUALCOBO/SAN BARTOLOME DE CORNEJA/SANTA MARIA DEL BERROCAL/SANTIAGO DEL COLLADO/AREVALILLO/CASAS DEL PUERTO/MARTINEZ/MESEGAR DE CORNEJA/NARRILLOS DEL ALAMO/NAVAESCURIAL/SAN MIGUEL DE CORNEJA/ZAPARDIEL DE LA CAÑADA
2020-05-22;1701;Gerencia de Ávila;170119;C.S. SOTILLO DE ADRADA;Propuesta Fase 1;-4.6472208;40.2954901;SOTILLO DE ADRADA;Ávila;40.2954901,-4.6472208;ADRADA (LA)/HIGUERA DE LAS DUEÑAS/SANTA MARIA DEL TIETAR/CASAVIEJA/CASILLAS/NAVAHONDILLA/PIEDRALAVES/SOTILLO DE LA ADRADA/FRESNEDILLA
2020-05-22;1701;Gerencia de Ávila;170120;C.S. MUÑANA;Propuesta Fase 1;-5.0363658;40.5706538;MUÑANA;Ávila;40.5706538,-5.0363658;POVEDA/SANTA MARIA DEL ARROYO/SOLOSANCHO/TORRE (LA)/VADILLO DE LA SIERRA/VILLATORO/HIJA DE DIOS (LA)/MUÑANA/PRADOSEGAR/AMAVIDA/MENGAMUÑOZ/MUÑOGALINDO/MUÑOTELLO/NARROS DEL PUERTO/VILLANUEVA DEL CAMPILLO
2020-05-22;1702;Gerencia de Burgos;170205;C.S. BRIVIESCA;Propuesta Fase 1;-3.3925833;42.6158001;BRIVIESCA;Burgos;42.6158001,-3.3925833;CARCEDO DE BUREBA/CUBO DE BUREBA/GRISALEÑA/MIRANDA DE EBRO/MIRAVECHE/QUINTANABUREBA/QUINTANILLA SAN GARCIA/REINOSO/RUBLACEDO DE ABAJO/SALAS DE BUREBA/SANTA MARIA RIVARREDONDA/SANTA OLALLA DE BUREBA/BAÑUELOS DE BUREBA/BRIVIESCA/CANTABRANA/CARRIAS/CASCAJARES DE BUREBA/CASTIL DE PEONES/PIERNIGAS/QUINTANAELEZ/RUCANDIO/VALLARTA DE BUREBA/VID DE BUREBA (LA)/VILEÑA/ABAJAS/AGUAS CANDIDAS/AGUILAR DE BUREBA/ALCOCERO DE MOLA/BARRIOS DE BUREBA (LOS)/BERZOSA DE BUREBA/BUSTO DE BUREBA/FUENTEBUREBA/HORMAZAS (LAS)/LLANO DE BUREBA/NAVAS DE BUREBA/OÑA/PADRONES DE BUREBA/POZA DE LA SAL/PRADANOS DE BUREBA/QUINTANAVIDES/ROJAS/VILLANUEVA DE TEBA/ZUÑEDA
2020-05-22;1702;Gerencia de Burgos;170206;C.S. CRISTOBAL ACOSTA;Propuesta Fase 1;-3.6992069;42.3440772;CRISTOBAL ACOSTA;Burgos;42.3440772,-3.6992069;BURGOS
2020-05-22;1702;Gerencia de Burgos;170207;C.S. I. LOPEZ SAIZ;Propuesta Fase 1;-3.6981439;42.351365;I. LOPEZ SAIZ;Burgos;42.351365,-3.6981439;BURGOS
2020-05-22;1702;Gerencia de Burgos;170218;C.S. LOS CUBOS;Propuesta Fase 1;-3.742717;42.3602119;LOS CUBOS;Burgos;42.3602119,-3.742717;BURGOS
2020-05-22;1702;Gerencia de Burgos;170220;C.S. MELGAR FERNAMENTAL;Fase 1;-4.1777188;42.359536;MELGAR FERNAMENTAL;Burgos;42.359536,-4.1777188;CASTRILLO DE RIOPISUERGA/CASTRILLO MATAJUDIOS/CASTROJERIZ/HONTANAS/PADILLA DE ARRIBA/REZMONDO/VILLAQUIRAN DE LA PUEBLA/ZARZOSA DE RIO PISUERGA/ARENILLAS DE RIOPISUERGA/MELGAR DE FERNAMENTAL/PADILLA DE ABAJO/PEDROSA DEL PRINCIPE/SASAMON/CASTELLANOS DE CASTRO/VILLASANDINO
2020-05-22;1702;Gerencia de Burgos;170226;C.S. SALAS LOS INFANTES;Propuesta Fase 1;-3.2811979;42.0588261;SALAS LOS INFANTES;Burgos;42.0588261,-3.2811979;BARBADILLO DE HERREROS/CASTRILLO DE LA REINA/CONTRERAS/GALLEGA (LA)/HACINAS/JARAMILLO DE LA FUENTE/PINILLA DE LOS BARRUECOS/VALLE DE VALDELAGUNA/VIZCAINOS/BARBADILLO DEL MERCADO/BARBADILLO DEL PEZ/CAMPOLARA/CARAZO/HORTIGÜELA/MONCALVILLO/SALAS DE LOS INFANTES/SAN MILLAN DE LARA/SANTO DOMINGO DE SILOS/CABEZON DE LA SIERRA/HUERTA DE ARRIBA/MAMBRILLAS DE LARA/MAMOLAR/MONTERRUBIO DE LA DEMANDA/PINILLA DE LOS MOROS/REVILLA Y AHEDO (LA)/RIOCAVADO DE LA SIERRA
2020-05-22;1702;Gerencia de Burgos;170227;C.S. SAN AGUSTIN;Propuesta Fase 1;-3.6970311;42.3120645;SAN AGUSTIN;Burgos;42.3120645,-3.6970311;BURGOS
2020-05-22;1702;Gerencia de Burgos;170229;C.S. SEDANO;Propuesta Fase 2;-3.7494493;42.7559832;SEDANO;Burgos;42.7559832,-3.7494493;VALLE DE ZAMANZAS/ALTOS (LOS)/SARGENTES DE LA LORA/TUBILLA DEL AGUA/VALLE DE SEDANO
2020-05-22;1702;Gerencia de Burgos;170234;C.S. VALLE DE MENA;Propuesta Fase 2;-3.2710544;43.1138884;VALLE DE MENA;Burgos;43.1138884,-3.2710544;VALLE DE MENA
2020-05-22;1702;Gerencia de Burgos;170236;C.S. JOSE LUIS SANTAMARIA;Propuesta Fase 1;-3.6625856;42.3778915;JOSE LUIS SANTAMARIA;Burgos;42.3778915,-3.6625856;BURGOS
2020-05-22;1703;Gerencia de León;170302;C.S. ASTORGA I;Propuesta Fase 1;-6.0592017;42.472513;ASTORGA I;León;42.472513,-6.0592017;ASTORGA/SAN JUSTO DE LA VEGA/VILLAOBISPO DE OTERO
2020-05-22;1703;Gerencia de León;170304;C.S. SAN EMILIANO;Propuesta Fase 1;-6.03948;42.9619753;SAN EMILIANO;León;42.9619753,-6.03948;CABRILLANES/SAN EMILIANO/SENA DE LUNA
2020-05-22;1703;Gerencia de León;170305;C.S. BOÑAR;Propuesta Fase 1;-5.3350111;42.9342676;BOÑAR;León;42.9342676,-5.3350111;BOÑAR/VALDELUGUEROS/VALDEPIELAGO/VEGAQUEMADA/PUEBLA DE LILLO/VECILLA (LA)
2020-05-22;1703;Gerencia de León;170310;C.S. TRUCHAS;Propuesta Fase 2;-6.5124396;42.2812357;TRUCHAS;León;42.2812357,-6.5124396;ENCINEDO/CASTRILLO DE CABRERA/TRUCHAS
2020-05-22;1703;Gerencia de León;170312;C.S. ERAS DE RENUEVA;Propuesta Fase 1;-5.4972298;42.723601;ERAS DE RENUEVA;León;42.723601,-5.4972298;GARRAFE DE TORIO/VILLAQUILAMBRE/LEON/SANTA COLOMBA DE CURUEÑO
2020-05-22;1703;Gerencia de León;170320;C.S. RIAÑO;Propuesta Fase 2;-4.9636057;43.0527831;RIAÑO;León;43.0527831,-4.9636057;MARAÑA/RIAÑO/BURON/ACEBEDO/BOCA DE HUERGANO/OSEJA DE SAJAMBRE/POSADA DE VALDEON
2020-05-22;1703;Gerencia de León;170321;C.S. RIBERA DEL ESLA;Propuesta Fase 1;-5.2352506;42.6220766;RIBERA DEL ESLA;León;42.6220766,-5.2352506;VALDEPOLO/CUBILLAS DE RUEDA/GRADEFES
2020-05-22;1703;Gerencia de León;170323;C.S. SAHAGUN CAMPOS;Fase 1;-5.0507432;42.4547098;SAHAGUN CAMPOS;León;42.4547098,-5.0507432;SANTA MARIA DEL MONTE DE CEA/VILLAMARTIN DE DON SANCHO/VILLAZANZO DE VALDERADUEY/CALZADA DEL COTO/CEA/ESCOBAR DE CAMPOS/GORDALIZA DEL PINO/VILLASELAN/BERCIANOS DEL REAL CAMINO/CASTROTIERRA DE VALMADRIGAL/GRAJAL DE CAMPOS/JOARILLA DE LAS MATAS/SAHAGUN/VALLECILLO/VILLAMOL
2020-05-22;1703;Gerencia de León;170328;C.S. TROBAJO DEL CAMINO;Propuesta Fase 1;-5.6842775;42.5750157;TROBAJO DEL CAMINO;León;42.5750157,-5.6842775;SAN ANDRES DEL RABANEDO/VALVERDE DE LA VIRGEN
2020-05-22;1704;Gerencia de Ponferrada;170407;C.S. PUENTE DOMINGO FLOREZ;Fase 1;-6.7140276;42.4127795;PUENTE DOMINGO FLOREZ;León;42.4127795,-6.7140276;PUENTE DE DOMINGO FLOREZ/BENUZA/BORRENES/CARUCEDO
2020-05-22;1704;Gerencia de Ponferrada;170410;C.S. VILLAFRANCA BIERZO;Fase 1;-6.8923344;42.6316166;VILLAFRANCA BIERZO;León;42.6316166,-6.8923344;CARUCEDO/SOBRADO/VILLAFRANCA DEL BIERZO/BARJAS/OENCIA/TRABADELO/VILLADECANES/BALBOA/CORULLON/VEGA DE VALCARCE
2020-05-22;1704;Gerencia de Ponferrada;170411;C.S. PONFERRADA IV;Fase 1;-6.6267109;42.5980544;PONFERRADA IV;León;42.5980544,-6.6267109;CABAÑAS RARAS/PONFERRADA
2020-05-22;1705;Gerencia de Palencia;170503;C.S. CARRION DE LOS CONDES;Propuesta Fase 1;-4.624195;42.3504747;CARRION DE LOS CONDES;Palencia;42.3504747,-4.624195;BUSTILLO DEL PARAMO DE CARRION/LOMAS/PERALES/CARRION DE LOS CONDES/CERVATOS DE LA CUEZA/MANQUILLOS/NOGAL DE LAS HUERTAS/SERNA (LA)/VILLANUÑO DE VALDAVIA/VILLATURDE/VILLOLDO/ARCONADA/CALZADA DE LOS MOLINOS/LOMA DE UCIEZA/SAN MAMES DE CAMPOS/VALDE-UCIEZA/VILLALCAZAR DE SIRGA/VILLAMORONTA
2020-05-22;1705;Gerencia de Palencia;170506;C.S. GUARDO;Fase 1;-4.7793976;42.8075753;GUARDO;Palencia;42.8075753,-4.7793976;FRESNO DEL RIO/MANTINOS/SANTIBAÑEZ DE LA PEÑA/VILLALBA DE GUARDO/RESPENDA DE LA PEÑA/VELILLA DEL RIO CARRION/CONGOSTO DE VALDAVIA/GUARDO
2020-05-22;1705;Gerencia de Palencia;170507;C.S. HERRERA DE PISUERGA;Propuesta Fase 1;-4.3901949;42.6433636;HERRERA DE PISUERGA;Palencia;42.6433636,-4.3901949;AGUILAR DE CAMPOO/DEHESA DE ROMANOS/MICIECES DE OJEDA/OLEA DE BOEDO/OLMOS DE OJEDA/PARAMO DE BOEDO/PRADANOS DE OJEDA/REBOLLEDO DE LA TORRE/REVILLA DE COLLAZOS/SANTIBAÑEZ DE ECLA/VID DE OJEDA (LA)/ALAR DEL REY/CALAHORRA DE BOEDO/SOTOBAÑADO Y PRIORATO/BASCONES DE OJEDA/COLLAZOS DE BOEDO/HERRERA DE PISUERGA/PAYO DE OJEDA/VILLAMERIEL
2020-05-22;1705;Gerencia de Palencia;170510;C.S. OSORNO;Propuesta Fase 1;-4.3972754;42.42559;OSORNO;Palencia;42.42559,-4.3972754;CASTRILLO DE VILLAVEGA/ESPINOSA DE VILLAGONZALO/OSORNILLO/SAN CRISTOBAL DE BOEDO/SANTA CRUZ DE BOEDO/VILLASARRACINO/ABIA DE LAS TORRES/LANTADILLA/VILLAHERREROS/VILLAPROVEDO/BARCENA DE CAMPOS/OSORNO LA MAYOR
2020-05-22;1705;Gerencia de Palencia;170512;C.S. PAREDES DE NAVA;Fase 1;-4.7078451;42.1692388;PAREDES DE NAVA;Palencia;42.1692388,-4.7078451;BECERRIL DE CAMPOS/VALLE DEL RETORTILLO/FUENTES DE NAVA/PAREDES DE NAVA/RIBEROS DE LA CUEZA/VILLANUEVA DEL REBOLLAR/CARDEÑOSA DE VOLPEJERA/VILLAMUERA DE LA CUEZA
2020-05-22;1705;Gerencia de Palencia;170514;C.S. SALDAÑA;Propuesta Fase 1;-4.7204164;42.560098;SALDAÑA;Palencia;42.560098,-4.7204164;AYUELA/BUSTILLO DE LA VEGA/POZA DE LA VEGA/RENEDO DE LA VEGA/TABANERA DE VALDAVIA/VALDERRABANO/VILLAELES DE VALDAVIA/VILLARRABE/VILLASILA DE VALDAVIA/PINO DEL RIO/PUEBLA DE VALDAVIA (LA)/QUINTANILLA DE ONSOÑA/RESPENDA DE LA PEÑA/SALDAÑA/VILLABASTA DE VALDAVIA/VILLOTA DEL PARAMO/BUENAVISTA DE VALDAVIA/CONGOSTO DE VALDAVIA/PEDROSA DE LA VEGA/SANTERVAS DE LA VEGA/VILLALUENGA DE LA VEGA
2020-05-22;1705;Gerencia de Palencia;170519;C.S. VILLADA;Propuesta Fase 1;-4.9090124;42.2779499;VILLADA;Palencia;42.2779499,-4.9090124;POZO DE URAMA/LAGARTOS/LEDIGOS/VILLADA/BOADILLA DE RIOSECO/CISNEROS/MORATINOS/POBLACION DE ARROYO/SAN ROMAN DE LA CUBA/VILLACIDALER/VILLALCON
2020-05-22;1706;Gerencia de Salamanca;170603;C.S. BEJAR;Propuesta Fase 1;-5.8578389;40.3892584;BEJAR;Salamanca;40.3892584,-5.8578389;CALZADA DE BEJAR (LA)/COLMENAR DE MONTEMAYOR/HORCAJO DE MONTEMAYOR/LAGUNILLA/MONTEMAYOR DEL RIO/PEÑACABALLERA/SANCHOTELLO/SANTIBAÑEZ DE LA SIERRA/VALDEHIJADEROS/VALDELAGEVE/ALDEACIPRESTE/BEJAR/CANDELARIO/CERRO (EL)/HOYA (LA)/MOLINILLO/NAVACARROS/NAVALMORAL DE BEJAR/CANTAGALLO/CRISTOBAL/PINEDAS/PUERTO DE BEJAR/VALDEFUENTES DE SANGUSIN/VALLEJERA DE RIOFRIO
2020-05-22;1706;Gerencia de Salamanca;170604;C.S. CALZADA VALDUNCIEL;Fase 1;-5.7649621;41.1556443;CALZADA VALDUNCIEL;Salamanca;41.1556443,-5.7649621;SANTIZ/TOPAS/ARCO (EL)/CALZADA DE VALDUNCIEL/SAN PELAYO DE GUAREÑA/TORRESMENUDAS/ALDEARRODRIGO/AÑOVER DE TORMES/FORFOLEDA/PALACIOS DEL ARZOBISPO/VALDELOSA/VALDUNCIEL/ZAMAYON
2020-05-22;1706;Gerencia de Salamanca;170605;C.S. CANTALAPIEDRA;Fase 1;-5.21837;41.0921314;CANTALAPIEDRA;Salamanca;41.0921314,-5.21837;PALACIOSRUBIOS/POVEDA DE LAS CINTAS/TARAZONA DE GUAREÑA/VILLAFLORES/ZORITA DE LA FRONTERA/CANTALAPIEDRA
2020-05-22;1706;Gerencia de Salamanca;170611;C.S. GARRIDO NORTE;Propuesta Fase 1;-5.6512485;40.9831349;GARRIDO NORTE;Salamanca;40.9831349,-5.6512485;SALAMANCA
2020-05-22;1706;Gerencia de Salamanca;170616;C.S. LEDESMA;Propuesta Fase 1;-6.0954699;41.0899495;LEDESMA;Salamanca;41.0899495,-6.0954699;DOÑINOS DE LEDESMA/ENCINA DE SAN SILVESTRE/GEJUELO DEL BARRO/LEDESMA/MANZANO (EL)/SANDO/SANTA MARIA DE SANDO/SARDON DE LOS FRAILES/VILLARMAYOR/MONLERAS/VILLASDARDO/VILLASECO DE LOS GAMITOS/VILLASECO DE LOS REYES/MATA DE LEDESMA (LA)
2020-05-22;1706;Gerencia de Salamanca;170622;C.S. PERIURBANA NORTE;Propuesta Fase 1;-5.6415859;41.0249771;PERIURBANA NORTE;Salamanca;41.0249771,-5.6415859;ALDEALENGUA/ALDEARRUBIA/ALMENARA DE TORMES/CASTELLANOS DE MORISCOS/CASTELLANOS DE VILLIQUERA/MONTERRUBIO DE ARMUÑA/MORISCOS/SAN MORALES/VALVERDON/VILLARES DE LA REINA/JUZBADO/SAN CRISTOBAL DE LA CUESTA/CABRERIZOS/VILLAMAYOR
2020-05-22;1706;Gerencia de Salamanca;170626;C.S. ROBLEDA;Propuesta Fase 2;-6.576536;40.3713532;ROBLEDA;Salamanca;40.3713532,-6.576536;HERGUIJUELA DE CIUDAD RODRIGO/MARTIAGO/ROBLEDA/SAHUGO (EL)/VILLASRUBIAS/PEÑAPARDA/AGALLAS/PAYO (EL)
2020-05-22;1706;Gerencia de Salamanca;170630;C.S. TAMAMES;Propuesta Fase 1;-6.1158181;40.6516889;TAMAMES;Salamanca;40.6516889,-6.1158181;ALBA DE YELTES/ALDEANUEVA DE LA SIERRA/BERROCAL DE HUEBRA/CERECEDA DE LA SIERRA/CILLEROS DE LA BASTIDA/MORASVERDES/ABUSEJO/BARBALOS/DIOS LE GUARDE/NAVARREDONDA DE LA RINCONADA/TEJEDA Y SEGOYUELA/ALDEHUELA DE YELTES/BASTIDA (LA)/NARROS DE MATALAYEGUA/PUEBLA DE YELTES/RINCONADA DE LA SIERRA (LA)/SEPULCRO-HILARIO/TAMAMES
2020-05-22;1706;Gerencia de Salamanca;170634;C.S. VITIGUDINO;Propuesta Fase 1;-6.397953;41.061593;VITIGUDINO;Salamanca;41.061593,-6.397953;ALMENDRA/BOGAJO/BRINCONES/CABEZA DEL CABALLO/ENCINASOLA DE LOS COMENDADORES/ESPADAÑA/PERALEJOS DE ARRIBA/POZOS DE HINOJO/SANCHON DE LA RIBERA/TRABANCA/VALDERRODRIGO/VALSALABROSO/VIDOLA (LA)/VILLAR DE PERALONSO/VILLARMUERTO/VILLAVIEJA DE YELTES/GUADRAMIRO/IRUELOS/MORONTA/PEREÑA DE LA RIBERA/VITIGUDINO/AHIGAL DE VILLARINO/BARCEO/CIPEREZ/PEÑA (LA)/PERALEJOS DE ABAJO/PUERTAS/VILLAR DE SAMANIEGO/VILLARES DE YELTES/VILLARINO DE LOS AIRES/YECLA DE YELTES
2020-05-22;1707;Gerencia de Segovia;170703;C.S. CUELLAR;Propuesta Fase 1;-4.3165518;41.3472504;CUELLAR;Segovia;41.3472504,-4.3165518;FRESNEDA DE CUELLAR/VALLELADO/CHAÑE/GOMEZSERRACIN/OLOMBRADA/PINAREJOS/SANCHONUÑO/CUELLAR/FRUMALES/SAMBOAL/SAN CRISTOBAL DE CUELLAR
2020-05-22;1707;Gerencia de Segovia;170708;C.S. SEGOVIA I;Propuesta Fase 1;-4.114543;40.9380492;SEGOVIA I;Segovia;40.9380492,-4.114543;SEGOVIA
2020-05-22;1707;Gerencia de Segovia;170709;C.S. SEGOVIA II;Propuesta Fase 1;-4.1068163;40.9420283;SEGOVIA II;Segovia;40.9420283,-4.1068163;SEGOVIA
2020-05-22;1707;Gerencia de Segovia;170716;C.S. SACRAMENIA;Propuesta Fase 1;-3.9279862;41.4623748;SACRAMENIA;Segovia;41.4623748,-3.9279862;FUENTESOTO/FUENTIDUEÑA/CASTRO DE FUENTIDUEÑA/CUEVAS DE PROVANCO/LAGUNA DE CONTRERAS/SACRAMENIA/TORREADRADA/CASTROJIMENO/VALTIENDAS
2020-05-22;1708;Gerencia de Soria;170804;C.S. BERLANGA DE DUERO;Fase 1;-2.8636289;41.4257913;BERLANGA DE DUERO;Soria;41.4257913,-2.8636289;ARENILLAS/BARCONES/BAYUBAS DE ARRIBA/BERLANGA DE DUERO/BAYUBAS DE ABAJO/CALTOJAR/FUENTEPINILLA/QUINTANA REDONDA/RELLO/RIBA DE ESCALOTE (LA)/VALDERRODILLA/RETORTILLO DE SORIA/TAJUECO
2020-05-22;1708;Gerencia de Soria;170812;C.S. S.PEDRO MANRIQUE;Propuesta Fase 2;-2.293891;42.0324759;S.PEDRO MANRIQUE;Soria;42.0324759,-2.293891;ALDEHUELAS (LAS)/CERBON/VILLAR DEL RIO/VIZMANOS/YANGUAS/FUENTES DE MAGAÑA/ONCALA/SAN PEDRO MANRIQUE/SANTA CRUZ DE YANGUAS
2020-05-22;1709;Gerencia de Valladolid Oeste;170906;C.S. PLAZA DEL EJERCITO;Propuesta Fase 1;-4.7383372;41.6365797;PLAZA DEL EJERCITO;Valladolid;41.6365797,-4.7383372;VALLADOLID
2020-05-22;1709;Gerencia de Valladolid Oeste;170915;C.S. PARQUESOL;Propuesta Fase 1;-4.7609774;41.6353453;PARQUESOL;Valladolid;41.6353453,-4.7609774;VALLADOLID
2020-05-22;1709;Gerencia de Valladolid Oeste;170920;C.S. TORDESILLAS;Propuesta Fase 1;-5.0713588;41.5447792;TORDESILLAS;Valladolid;41.5447792,-5.0713588;BERCERUELO/SAN MIGUEL DEL PINO/SAN SALVADOR/TORRECILLA DE LA ABADESA/VILLAN DE TORDESILLAS/BERCERO/MATILLA DE LOS CAÑOS/PEDROSA DEL REY/SAN ROMAN DE HORNIJA/TORDESILLAS/TORRECILLA DE LA TORRE/VELILLA/BARRUELO DEL VALLE/POLLOS/ROBLADILLO/SAN PELAYO/TORRELOBATON/VELLIZA/VILLALAR DE LOS COMUNEROS/VILLASEXMIR
2020-05-22;1709;Gerencia de Valladolid Oeste;170925;C.S. VILLALON DE CAMPOS;Fase 1;-5.059256;42.1180914;VILLALON DE CAMPOS;Valladolid;42.1180914,-5.059256;CABEZON DE VALDERADUEY/CUENCA DE CAMPOS/FONTIHOYUELO/HERRIN DE CAMPOS/VEGA DE RUIPONCE/VILLACARRALON/VILLANUEVA DE LA CONDESA/BUSTILLO DE CHAVES/GATON DE CAMPOS/SANTERVAS DE CAMPOS/VILLABARUZ DE CAMPOS/VILLACID DE CAMPOS/VILLAGOMEZ LA NUEVA/CEINOS DE CAMPOS/VILLAFRADES DE CAMPOS/VILLALON DE CAMPOS
2020-05-22;1709;Gerencia de Valladolid Oeste;170927;C.S. DELICIAS I;Propuesta Fase 1;-4.7079834;41.6161785;DELICIAS I;Valladolid;41.6161785,-4.7079834;CISTERNIGA/VALLADOLID
2020-05-22;1710;Gerencia de Valladolid Este;171001;C.S. BARRIO ESPAÑA;Propuesta Fase 1;-4.7052252;41.675017;BARRIO ESPAÑA;Valladolid;41.675017,-4.7052252;VALLADOLID
2020-05-22;1710;Gerencia de Valladolid Este;171007;C.S. MAGDALENA;Propuesta Fase 1;-4.7117729;41.6599262;MAGDALENA;Valladolid;41.6599262,-4.7117729;VALLADOLID
2020-05-22;1710;Gerencia de Valladolid Este;171008;C.S. TORTOLA;Propuesta Fase 1;-4.696616;41.6303261;TORTOLA;Valladolid;41.6303261,-4.696616;VALLADOLID
2020-05-22;1710;Gerencia de Valladolid Este;171011;C.S. RONDILLA I;Propuesta Fase 1;-4.7254269;41.660879;RONDILLA I;Valladolid;41.660879,-4.7254269;VALLADOLID
2020-05-22;1710;Gerencia de Valladolid Este;171012;C.S. RONDILLA II;Propuesta Fase 1;-4.7205359;41.664046;RONDILLA II;Valladolid;41.664046,-4.7205359;VALLADOLID
2020-05-22;1710;Gerencia de Valladolid Este;171014;C.S. SAN PABLO;Propuesta Fase 1;-4.7265359;41.6561919;SAN PABLO;Valladolid;41.6561919,-4.7265359;VALLADOLID
2020-05-22;1710;Gerencia de Valladolid Este;171015;C.S. PEÑAFIEL;Propuesta Fase 1;-4.1875837;41.5834053;PEÑAFIEL;Valladolid;41.5834053,-4.1875837;CURIEL DE DUERO/LANGAYO/PEÑAFIEL/RABANO/SAN LLORENTE/VALBUENA DE DUERO/BOCOS DE DUERO/CAMPASPERO/CANALEJAS DE PEÑAFIEL/CASTRILLO DE DUERO/COGECES DEL MONTE/MANZANILLO/PIÑEL DE ABAJO/PIÑEL DE ARRIBA/QUINTANILLA DE ARRIBA/BAHABON/CORRALES DE DUERO/FOMPEDRAZA/OLMOS DE PEÑAFIEL/PESQUERA DE DUERO/TORRE DE PEÑAFIEL/TORRESCARCELA/VALDEARCOS DE LA VEGA
2020-05-22;1710;Gerencia de Valladolid Este;171016;C.S. PORTILLO;Propuesta Fase 1;-4.5726832;41.4774359;PORTILLO;Valladolid;41.4774359,-4.5726832;CAMPORREDONDO/MONTEMAYOR DE PILILLA/PEDRAJA DE PORTILLO (LA)/SAN MIGUEL DEL ARROYO/VILORIA/ALDEA DE SAN MIGUEL/ALDEAMAYOR DE SAN MARTIN/MOJADOS/PORTILLO
2020-05-22;1710;Gerencia de Valladolid Este;171017;C.S. SERRADA;Propuesta Fase 1;-4.8411889;41.4508581;SERRADA;Valladolid;41.4508581,-4.8411889;MATAPOZUELOS/VENTOSA DE LA CUESTA/SERRADA/VALDESTILLAS/SECA (LA)/VILLANUEVA DE DUERO
2020-05-22;1710;Gerencia de Valladolid Este;171020;C.S. OLMEDO;Propuesta Fase 1;-4.695628;41.2972206;OLMEDO;Valladolid;41.2972206,-4.695628;OLMEDO/ALMENARA DE ADAJA/HORNILLOS DE ERESMA/LLANO DE OLMEDO/ZARZA (LA)/ALCAZAREN/BOCIGAS/FUENTE-OLMEDO/PURAS
2020-05-22;1710;Gerencia de Valladolid Este;171025;C.S. VALLADOLID RURAL I;Propuesta Fase 1;-4.6211316;41.6733784;VALLADOLID RURAL I;Valladolid;41.6733784,-4.6211316;CABEZON DE PISUERGA/CASTRONUEVO DE ESGUEVA/VILLARMENTERO DE ESGUEVA/RENEDO DE ESGUEVA/SANTOVENIA DE PISUERGA
2020-05-22;1711;Gerencia de Zamora;171102;C.S. ALCAÑICES;Propuesta Fase 2;-6.3315738;41.7589564;ALCAÑICES;Zamora;41.7589564,-6.3315738;ALCAÑICES/TRABAZOS/FIGUERUELA DE ARRIBA/GALLEGOS DEL RIO/MAHIDE/PINO DEL ORO/RABANALES/RABANO DE ALISTE/SAMIR DE LOS CAÑOS/FONFRIA/SAN VICENTE DE LA CABEZA/SAN VITERO/VIÑAS
2020-05-22;1711;Gerencia de Zamora;171103;C.S. ALTA SANABRIA;Propuesta Fase 2;-6.879117;42.0861616;ALTA SANABRIA;Zamora;42.0861616,-6.879117;HERMISENDE/PORTO/LUBIAN/PIAS
2020-05-22;1711;Gerencia de Zamora;171104;C.S. BENAVENTE NORTE;Propuesta Fase 1;-5.7625318;42.0547064;BENAVENTE NORTE;Zamora;42.0547064,-5.7625318;BENAVENTE/MORALES DE REY/POBLADURA DEL VALLE/SANTA CRISTINA DE LA POLVOROSA/TORRE DEL VALLE (LA)/VILLAFERRUEÑA/BRIME DE URZ/COOMONTE/QUINTANILLA DE URZ/QUIRUELAS DE VIDRIALES/SANTA MARIA DE LA VEGA/FRESNO DE LA POLVOROSA/MAIRE DE CASTROPONCE/MANGANESES DE LA POLVOROSA/VILLABRAZARO/VILLANAZAR
2020-05-22;1711;Gerencia de Zamora;171106;C.S. CAMARZANA DE TERA;Fase 1;-6.0366846;41.9912912;CAMARZANA DE TERA;Zamora;41.9912912,-6.0366846;SAN PEDRO DE CEQUE/VEGA DE TERA/CALZADILLA DE TERA/CAMARZANA DE TERA/MELGAR DE TERA/MICERECES DE TERA/SANTIBAÑEZ DE TERA/SANTA CROYA DE TERA/VILLANUEVA DE LAS PERAS
2020-05-22;1711;Gerencia de Zamora;171109;C.S. MOMBUEY;Fase 1;-6.3616617;42.0450526;MOMBUEY;Zamora;42.0450526,-6.3616617;ASTURIANOS/ESPADAÑEDO/MANZANAL DE ARRIBA/MANZANAL DE LOS INFANTES/ROSINOS DE LA REQUEJADA/JUSTEL/MOMBUEY/PEQUE/RIONEGRO DEL PUENTE/VILLARDECIERVOS/CERNADILLA/FERRERAS DE ARRIBA/MUELAS DE LOS CABALLEROS
2020-05-22;1711;Gerencia de Zamora;171110;C.S. CORRALES DEL VINO;Propuesta Fase 2;-5.7465007;41.3106752;CORRALES DEL VINO;Zamora;41.3106752,-5.7465007;CABAÑAS DE SAYAGO/CORRALES/CORRALES DEL VINO/PELEAS DE ABAJO/VILLANUEVA DE CAMPEAN/CUBO DE TIERRA DEL VINO (EL)/FUENTESPREADAS/PEÑAUSENDE/SANTA CLARA DE AVEDILLO/CASASECA DE CAMPEAN/CUELGAMURES/JAMBRINA/MAYALDE/PIÑERO (EL)
2020-05-22;1711;Gerencia de Zamora;171111;C.S. PUERTA NUEVA;Propuesta Fase 1;-5.7402331;41.500653;PUERTA NUEVA;Zamora;41.500653,-5.7402331;ZAMORA
2020-05-22;1711;Gerencia de Zamora;171114;C.S. PUEBLA DE SANABRIA;Propuesta Fase 1;-6.6501789;42.0813187;PUEBLA DE SANABRIA;Zamora;42.0813187,-6.6501789;PALACIOS DE SANABRIA/TREFACIO/COBREROS/PEDRALBA DE LA PRADERIA/ROBLEDA-CERVANTES/GALENDE/PUEBLA DE SANABRIA/REQUEJO/ROSINOS DE LA REQUEJADA/SAN JUSTO
2020-05-22;1711;Gerencia de Zamora;171116;C.S. TABARA;Propuesta Fase 2;-6.0110225;41.8448438;TABARA;Zamora;41.8448438,-6.0110225;MORALES DE VALVERDE/OTERO DE BODAS/POZUELO DE TABARA/RIOFRIO DE ALISTE/TABARA/FERRERAS DE ABAJO/FERRERAS DE ARRIBA/PUEBLICA DE VALVERDE/FARAMONTANOS DE TABARA/FERRERUELA/MORERUELA DE TABARA/PERILLA DE CASTRO/SANTA MARIA DE VALVERDE/VILLAVEZA DE VALVERDE
2020-05-22;1711;Gerencia de Zamora;171121;C.S. ZAMORA NORTE;Propuesta Fase 1;-5.7908384;41.5774755;ZAMORA NORTE;Zamora;41.5774755,-5.7908384;ALGODRE/ALMARAZ DE DUERO/ANDAVIAS/CUBILLOS/GALLEGOS DEL PAN/HINIESTA (LA)/MUELAS DEL PAN/VALCABADO/VILLALUBE/VILLASECO DEL PAN/ASPARIEGOS/MONTAMARTA/MORERUELA DE LOS INFANZONES/PALACIOS DEL PAN/ROALES/SAN PEDRO DE LA NAVE-ALMENDRA/BENEGILES/CORESES/FRESNO DE LA RIBERA/MATILLA LA SECA/MOLACILLOS/MONFARRACINOS/TORRES DEL CARRIZAL/VILLALCAMPO/ZAMORA
2020-05-25;1701;Gerencia de Ávila;170103;C.S. AVILA ESTACION;Fase 1;-4.61;40.685;AVILA ESTACION;Ávila;40.685,-4.61;AVILA
2020-05-25;1701;Gerencia de Ávila;170104;C.S. AVILA NORTE;Fase 1;-4.7125253;40.6965512;AVILA NORTE;Ávila;40.6965512,-4.7125253;AVILA
2020-05-25;1701;Gerencia de Ávila;170106;C.S. LANZAHITA;Fase 1;-4.8974015;40.2409102;LANZAHITA;Ávila;40.2409102,-4.8974015;GAVILANES/LANZAHITA/MOMBELTRAN/MIJARES/PEDRO BERNARDO
2020-05-25;1701;Gerencia de Ávila;170111;C.S. CEBREROS;Fase 1;-4.4395554;40.4517812;CEBREROS;Ávila;40.4517812,-4.4395554;CEBREROS/TIEMBLO (EL)/HOYO DE PINARES (EL)
2020-05-25;1701;Gerencia de Ávila;170113;C.S. NAVARREDONDA GREDOS;Fase 1;-5.1468286;40.3763715;NAVARREDONDA GREDOS;Ávila;40.3763715,-5.1468286;CEPEDA LA MORA/SAN MARTIN DEL PIMPOLLAR/HOYOS DE MIGUEL MUÑOZ/HOYOS DEL ESPINO/NAVADIJOS/NAVARREDONDA DE GREDOS/SAN JUAN DE GREDOS/SAN MARTIN DE LA VEGA DEL ALBERCHE/GARGANTA DEL VILLAR/HOYOS DEL COLLADO
2020-05-25;1701;Gerencia de Ávila;170115;C.S. MADRIGAL DE LAS ALTAS TORRES;Fase 1;-5.020748;41.074037;MADRIGAL DE LAS ALTAS TORRES;Ávila;41.074037,-5.020748;BERCIAL DE ZAPARDIEL/BLASCONUÑO DE MATACABRAS/CASTELLANOS DE ZAPARDIEL/HORCAJO DE LAS TORRES/MADRIGAL DE LAS ALTAS TORRES/RASUEROS/SAN ESTEBAN DE ZAPARDIEL/BARROMAN/MORALEJA DE MATACABRAS/MAMBLAS
2020-05-25;1701;Gerencia de Ávila;170116;C.S. MOMBELTRAN;Fase 1;-4.996585;40.2764479;MOMBELTRAN;Ávila;40.2764479,-4.996585;SAN ESTEBAN DEL VALLE/SANTA CRUZ DEL VALLE/VILLAREJO DEL VALLE/CUEVAS DEL VALLE/MOMBELTRAN
2020-05-25;1701;Gerencia de Ávila;170118;C.S. SAN PEDRO ARROYO;Fase 1;-4.9304366;40.814332;SAN PEDRO ARROYO;Ávila;40.814332,-4.9304366;GRANDES Y SAN MARTIN/NARROS DEL CASTILLO/PAPATRIGO/RIOCABADO/SAN PEDRO DEL ARROYO/SIGERES/VITA/ALBORNOS/HERREROS DE SUSO/NARROS DE SALDUEÑA/PARRAL (EL)/SAN JUAN DE LA ENCINILLA/VIÑEGRA DE MORAÑA/AVEINTE/BLASCOMILLAN/BRABOS/BULARROS/CABIZUELA/MUÑOGRANDE/MUÑOMER DEL PECO/SANTO TOME DE ZABARCOS/VILLAFLOR
2020-05-25;1701;Gerencia de Ávila;170120;C.S. MUÑANA;Fase 1;-5.0363658;40.5706538;MUÑANA;Ávila;40.5706538,-5.0363658;POVEDA/SANTA MARIA DEL ARROYO/SOLOSANCHO/TORRE (LA)/VADILLO DE LA SIERRA/VILLATORO/HIJA DE DIOS (LA)/MUÑANA/PRADOSEGAR/AMAVIDA/MENGAMUÑOZ/MUÑOGALINDO/MUÑOTELLO/NARROS DEL PUERTO/VILLANUEVA DEL CAMPILLO
2020-05-25;1701;Gerencia de Ávila;170121;C.S. MUÑICO;Fase 1;-5.1006928;40.706767;MUÑICO;Ávila;40.706767,-5.1006928;CHAMARTIN/MIRUEÑA DE LOS INFANZONES/MUÑICO/CILLAN/HURTUMPASCUAL/MANCERA DE ARRIBA/SAN GARCIA DE INGELMOS/SAN JUAN DEL OLMO/SOLANA DE RIOALMAR/CABEZAS DEL VILLAR/GALLEGOS DE SOBRINOS/MANJABALAGO/NARRILLOS DEL REBOLLAR/VALDECASA
2020-05-25;1702;Gerencia de Burgos;170201;C.S. ARANDA NORTE;Fase 1;-3.6555077;41.6891216;ARANDA NORTE;Burgos;41.6891216,-3.6555077;ARANDA DE DUERO
2020-05-25;1702;Gerencia de Burgos;170204;C.S. BELORADO;Fase 1;-3.2049005;42.3861643;BELORADO;Burgos;42.3861643,-3.2049005;BASCUÑANA/FRESNEÑA/REDECILLA DEL CAMPO/SANTA CRUZ DEL VALLE URBION/TOSANTOS/VALLE DE OCA/VALMALA/VILLAFRANCA MONTES DE OCA/CASTILDELGADO/ESPINOSA DEL CAMINO/FRESNO DE RIO TIRON/IBRILLOS/MIRANDA DE EBRO/PRADOLUENGO/VILORIA DE RIOJA/BELORADO/CEREZO DE RIO TIRON/CERRATON DE JUARROS/FRESNEDA DE LA SIERRA TIRON/REDECILLA DEL CAMINO/VILLAGALIJO/VILLAMBISTIA
2020-05-25;1702;Gerencia de Burgos;170206;C.S. CRISTOBAL ACOSTA;Fase 1;-3.6992069;42.3440772;CRISTOBAL ACOSTA;Burgos;42.3440772,-3.6992069;BURGOS
2020-05-25;1702;Gerencia de Burgos;170207;C.S. I. LOPEZ SAIZ;Fase 1;-3.6981439;42.351365;I. LOPEZ SAIZ;Burgos;42.351365,-3.6981439;BURGOS
2020-05-25;1702;Gerencia de Burgos;170208;C.S. BURGOS RURAL NORTE;Fase 1;-3.5966157;42.4521283;BURGOS RURAL NORTE;Burgos;42.4521283,-3.5966157;ARRAYA DE OCA/FRESNO DE RODILLA/HURONES/MEDINA DE POMAR/MONASTERIO DE RODILLA/MONTORIO/PINEDA DE LA SIERRA/VALLE DE SEDANO/BARRIOS DE COLINA/CARDEÑUELA RIOPICO/HUERMECES/MERINDAD DE RIO UBIERNA/RUBENA/SANTA MARIA DEL INVIERNO/VALLE DE LAS NAVAS/VALLE DE SANTIBAÑEZ/ALFOZ DE QUINTANADUEÑAS/ARLANZON/ATAPUERCA/BURGOS/ORBANEJA RIOPICO/QUINTANAORTUÑO/QUINTANAPALLA/QUINTANILLA VIVAR/SOTRAGERO/URBEL DEL CASTILLO/VILLAESCUSA LA SOMBRIA/VILLASUR DE HERREROS/VILLAYERNO MORQUILLAS
