Total acumulado desde el inicio (31/01/20);30/05/2020
Total acumulado de casos confirmados desde el inicio (31/01/2020);16133
Total acumulado de PCR+ desde el inicio (31/01/2020);11209
Total casos confirmados hospitalizados (incluyendo UCI) en el día;156
Total casos confirmados hospitalizados en UCI en el día;24
Total acumulado de casos confirmados dados de alta epidemiológica desde el inicio (31/01/2020);12179
Total acumulado de casos confirmados fallecidos desde el inicio (31/01/2020);1432
